2025.06.13 17:00;2;Michigan Consumer Expectations  (Jun)
2025.06.13 17:00;2;Michigan Consumer Sentiment  (Jun)
2025.06.13 18:00;2;ECB's Elderson Speaks
2025.06.13 20:00;2;U.S. Baker Hughes Oil Rig Count
2025.06.13 20:00;2;U.S. Baker Hughes Total Rig Count
2025.06.13 22:30;2;CFTC GBP speculative net positions
2025.06.13 22:30;2;CFTC Crude Oil speculative net positions
2025.06.13 22:30;2;CFTC Gold speculative net positions
2025.06.13 22:30;2;CFTC Nasdaq 100 speculative net positions
2025.06.13 22:30;2;CFTC S&P 500 speculative net positions
2025.06.13 22:30;2;CFTC JPY speculative net positions
2025.06.13 22:30;2;CFTC EUR speculative net positions
2025.06.16 05:00;2;Fixed Asset Investment (YoY)  (May)
2025.06.16 05:00;2;Industrial Production (YoY)  (May)
2025.06.16 05:00;2;Chinese Industrial Production YTD  (YoY)  (May)
2025.06.16 05:00;2;Chinese Unemployment Rate  (May)
2025.06.16 05:00;2;NBS Press Conference
2025.06.16 09:30;2;WPI Inflation (YoY)  (May)
2025.06.16 12:00;2;Wages in euro zone (YoY)  (Q1)
2025.06.16 14:00;2;OPEC Monthly Report
2025.06.16 15:30;2;NY Empire State Manufacturing Index  (Jun)
2025.06.16 20:00;2;20-Year Bond Auction
2025.06.17 05:30;2;BoJ Monetary Policy Statement
2025.06.17 06:00;3;BoJ Interest Rate Decision
2025.06.17 09:30;2;BoJ Press Conference
2025.06.17 11:00;2;IEA Monthly Report
2025.06.17 12:00;2;ZEW Economic Sentiment  (Jun)
2025.06.17 15:30;3;Core Retail Sales (MoM)  (May)
2025.06.17 15:30;2;Export Price Index (MoM)  (May)
2025.06.17 15:30;2;Import Price Index (MoM)  (May)
2025.06.17 15:30;2;Retail Control (MoM)  (May)
2025.06.17 15:30;3;Retail Sales (MoM)  (May)
2025.06.17 16:15;2;Industrial Production (MoM)  (May)
2025.06.17 16:15;2;Industrial Production (YoY)  (May)
2025.06.17 17:00;2;Business Inventories (MoM)  (Apr)
2025.06.17 17:00;2;Retail Inventories Ex Auto  (Apr)
2025.06.17 19:00;2;Atlanta Fed GDPNow  (Q2)
2025.06.17 20:00;2;5-Year TIPS Auction
2025.06.17 23:30;2;API Weekly Crude Oil Stock
2025.06.18 02:50;2;Adjusted Trade Balance
2025.06.18 02:50;2;Exports (YoY)  (May)
2025.06.18 02:50;2;Trade Balance  (May)
2025.06.18 09:00;3;CPI (YoY)  (May)
2025.06.18 09:00;2;CPI (MoM)  (May)
2025.06.18 10:30;2;ECB's Elderson Speaks
2025.06.18 12:00;2;Core CPI (YoY)  (May)
2025.06.18 12:00;2;CPI (MoM)  (May)
2025.06.18 12:00;3;CPI (YoY)  (May)
2025.06.18 15:30;2;Building Permits  (May)
2025.06.18 15:30;2;Continuing Jobless Claims
2025.06.18 15:30;2;Housing Starts  (May)
2025.06.18 15:30;2;Housing Starts (MoM)  (May)
2025.06.18 15:30;3;Initial Jobless Claims
2025.06.18 17:30;3;Crude Oil Inventories
2025.06.18 17:30;2;Cushing Crude Oil Inventories
2025.06.18 18:00;2;ECB's Lane Speaks
2025.06.18 18:30;2;Atlanta Fed GDPNow  (Q2)
2025.06.18 21:00;2;Interest Rate Projection - 1st Yr  (Q2)
2025.06.18 21:00;2;Interest Rate Projection - 2nd Yr  (Q2)
2025.06.18 21:00;2;Interest Rate Projection - Current  (Q2)
2025.06.18 21:00;2;Interest Rate Projection - Longer  (Q2)
2025.06.18 21:00;3;FOMC Economic Projections
2025.06.18 21:00;3;FOMC Statement
2025.06.18 21:00;3;Fed Interest Rate Decision
2025.06.18 21:00;2;ECB's De Guindos Speaks
2025.06.18 21:30;3;FOMC Press Conference
2025.06.18 23:00;2;TIC Net Long-Term Transactions  (Apr)
2025.06.19 10:30;2;ECB President Lagarde Speaks
2025.06.19 12:45;2;ECB's De Guindos Speaks
2025.06.19 13:00;2;Eurogroup Meetings
2025.06.19 13:30;2;ECB President Lagarde Speaks
2025.06.19 14:00;2;BoE MPC vote cut  (Jun)
2025.06.19 14:00;2;BoE MPC vote hike  (Jun)
2025.06.19 14:00;2;BoE MPC vote unchanged  (Jun)
2025.06.19 14:00;3;BoE Interest Rate Decision  (Jun)
2025.06.19 14:00;2;BoE MPC Meeting Minutes
2025.06.20 02:30;2;National Core CPI (YoY)  (May)
2025.06.20 02:30;2;National CPI (MoM)  (May)
2025.06.20 02:50;2;Monetary Policy Meeting Minutes
2025.06.20 04:00;2;China Loan Prime Rate 5Y  (Jun)
2025.06.20 04:00;2;PBoC Loan Prime Rate
2025.06.20 09:00;2;Core Retail Sales (MoM)  (May)
2025.06.20 09:00;2;Core Retail Sales (YoY)  (May)
2025.06.20 09:00;2;Retail Sales (YoY)  (May)
2025.06.20 09:00;2;Retail Sales (MoM)  (May)
2025.06.20 11:00;2;ECB Economic Bulletin
2025.06.20 13:00;2;Eurogroup Meetings
2025.06.20 14:30;2;RBI MPC Meeting Minutes
2025.06.20 15:30;3;Philadelphia Fed Manufacturing Index  (Jun)
2025.06.20 15:30;2;Philly Fed Employment  (Jun)
2025.06.20 17:00;2;US Leading Index (MoM)  (May)
2025.06.20 18:00;3;Fed Monetary Policy Report
2025.06.20 20:00;2;U.S. Baker Hughes Oil Rig Count
2025.06.20 20:00;2;U.S. Baker Hughes Total Rig Count
2025.06.20 23:30;2;Fed's Balance Sheet
2025.06.22 05:00;3;U.S. President Trump Speaks
2025.06.22 20:15;2;FOMC Member Daly Speaks
2025.06.23 03:30;2;au Jibun Bank Services PMI  (Jun)
2025.06.23 10:00;2;Fed Waller Speaks
2025.06.23 11:00;2;HCOB Eurozone Manufacturing PMI  (Jun)
2025.06.23 11:00;2;HCOB Eurozone Composite PMI  (Jun)
2025.06.23 11:00;2;HCOB Eurozone Services PMI  (Jun)
2025.06.23 11:30;2;S&P Global Composite PMI  (Jun)
2025.06.23 11:30;2;S&P Global Manufacturing PMI  (Jun)
2025.06.23 11:30;2;S&P Global Services PMI  (Jun)
2025.06.23 16:00;2;ECB President Lagarde Speaks
2025.06.23 16:45;3;S&P Global Manufacturing PMI  (Jun)
2025.06.23 16:45;2;S&P Global Composite PMI  (Jun)
2025.06.23 16:45;3;S&P Global Services PMI  (Jun)
2025.06.23 17:00;2;Existing Home Sales (MoM)  (May)
2025.06.23 17:00;3;Existing Home Sales  (May)
2025.06.23 17:00;2;FOMC Member Bowman Speaks
2025.06.23 21:30;2;FOMC Member Williams Speaks
2025.06.23 22:30;2;CFTC GBP speculative net positions
2025.06.23 22:30;2;CFTC Crude Oil speculative net positions
2025.06.23 22:30;2;CFTC Gold speculative net positions
2025.06.23 22:30;2;CFTC Nasdaq 100 speculative net positions
2025.06.23 22:30;2;CFTC S&P 500 speculative net positions
2025.06.23 22:30;2;CFTC JPY speculative net positions
2025.06.23 22:30;2;CFTC EUR speculative net positions
2025.06.24 08:00;2;BoJ Core CPI (YoY)
2025.06.24 11:00;2;BoE Gov Bailey Speaks
2025.06.24 14:15;2;ECB's De Guindos Speaks
2025.06.24 15:30;2;Current Account  (Q1)
2025.06.24 16:00;2;S&P/CS HPI Composite - 20 n.s.a. (YoY)  (Apr)
2025.06.24 16:00;2;S&P/CS HPI Composite - 20 n.s.a. (MoM)  (Apr)
2025.06.24 16:00;2;ECB President Lagarde Speaks
2025.06.24 16:35;2;MPC Member Ramsden Speaks
2025.06.24 16:55;2;ECB's Lane Speaks
2025.06.24 17:00;2;BoE Gov Bailey Speaks
2025.06.24 17:00;3;CB Consumer Confidence  (Jun)
2025.06.24 17:00;3;Fed Chair Powell Testifies
2025.06.24 18:40;2;BoE MPC Member Pill Speaks
2025.06.24 19:30;2;FOMC Member Williams Speaks
2025.06.24 21:00;2;2-Year Note Auction
2025.06.24 23:00;2;Fed Vice Chair for Supervision Barr Speaks
2025.06.24 23:30;2;API Weekly Crude Oil Stock
2025.06.25 15:30;2;Building Permits  (May)
2025.06.25 17:00;3;Fed Chair Powell Testifies
2025.06.25 17:00;2;New Home Sales (MoM)  (May)
2025.06.25 17:00;3;New Home Sales  (May)
2025.06.25 17:30;3;Crude Oil Inventories
2025.06.25 17:30;2;Cushing Crude Oil Inventories
2025.06.25 20:00;2;5-Year Note Auction
2025.06.26 12:45;2;ECB's De Guindos Speaks
2025.06.26 13:00;2;EU Leaders Summit
2025.06.26 14:00;2;BoE Gov Bailey Speaks
2025.06.26 14:00;2;ECB's Schnabel Speaks
2025.06.26 15:30;2;Continuing Jobless Claims
2025.06.26 15:30;2;Core Durable Goods Orders (MoM)  (May)
2025.06.26 15:30;2;Core PCE Prices  (Q1)
2025.06.26 15:30;3;Durable Goods Orders (MoM)  (May)
2025.06.26 15:30;3;GDP (QoQ)  (Q1)
2025.06.26 15:30;2;GDP Price Index (QoQ)  (Q1)
2025.06.26 15:30;2;Goods Trade Balance  (May)
2025.06.26 15:30;3;Initial Jobless Claims
2025.06.26 15:30;2;Retail Inventories Ex Auto  (May)
2025.06.26 15:45;2;FOMC Member Daly Speaks
2025.06.26 17:00;2;Pending Home Sales (MoM)  (May)
2025.06.26 20:00;2;7-Year Note Auction
2025.06.26 20:15;2;Fed Vice Chair for Supervision Barr Speaks
2025.06.26 21:30;2;ECB President Lagarde Speaks
2025.06.26 23:30;2;Fed's Balance Sheet
2025.06.27 02:00;2;FOMC Member Kashkari Speaks
2025.06.27 02:30;2;Tokyo Core CPI (YoY)  (Jun)
2025.06.27 13:00;2;EU Leaders Summit
2025.06.27 14:30;2;FOMC Member Williams Speaks
2025.06.27 15:30;3;Core PCE Price Index (YoY)  (May)
2025.06.27 15:30;3;Core PCE Price Index (MoM)  (May)
2025.06.27 15:30;2;PCE Price index (YoY)  (May)
2025.06.27 15:30;2;PCE price index (MoM)  (May)
2025.06.27 15:30;2;Personal Spending (MoM)  (May)
2025.06.27 17:00;2;Michigan 1-Year Inflation Expectations  (Jun)
2025.06.27 17:00;2;Michigan 5-Year Inflation Expectations  (Jun)
2025.06.27 17:00;2;Michigan Consumer Expectations  (Jun)
2025.06.27 17:00;2;Michigan Consumer Sentiment  (Jun)
2025.06.27 18:30;2;Atlanta Fed GDPNow  (Q2)
2025.06.27 20:00;2;U.S. Baker Hughes Oil Rig Count
2025.06.27 20:00;2;U.S. Baker Hughes Total Rig Count
2025.06.27 22:30;2;CFTC GBP speculative net positions
2025.06.27 22:30;2;CFTC Crude Oil speculative net positions
2025.06.27 22:30;2;CFTC Gold speculative net positions
2025.06.27 22:30;2;CFTC Nasdaq 100 speculative net positions
2025.06.27 22:30;2;CFTC S&P 500 speculative net positions
2025.06.27 22:30;2;CFTC JPY speculative net positions
2025.06.27 22:30;2;CFTC EUR speculative net positions
2025.06.27 23:30;2;Fed Bank Stress Test Results
2025.06.28 18:30;2;ECB's Schnabel Speaks
2025.06.30 02:50;2;Industrial Production (MoM)  (May)
2025.06.30 04:30;2;Chinese Composite PMI  (Jun)
2025.06.30 04:30;3;Manufacturing PMI  (Jun)
2025.06.30 04:30;2;Non-Manufacturing PMI  (Jun)
2025.06.30 09:00;2;Business Investment (QoQ)  (Q1)
2025.06.30 09:00;2;Current Account  (Q1)
2025.06.30 09:00;3;GDP (YoY)  (Q1)
2025.06.30 09:00;3;GDP (QoQ)  (Q1)
2025.06.30 11:30;2;ECB's De Guindos Speaks
2025.06.30 16:45;3;Chicago PMI  (Jun)
2025.06.30 17:00;2;FOMC Member Bostic Speaks
2025.06.30 20:30;2;ECB President Lagarde Speaks
2025.07.01 02:50;2;Tankan All Big Industry CAPEX  (Q2)
2025.07.01 02:50;2;Tankan Big Manufacturing Outlook Index  (Q2)
2025.07.01 02:50;2;Tankan Large Manufacturers Index  (Q2)
2025.07.01 02:50;2;Tankan Large Non-Manufacturers Index  (Q2)
2025.07.01 04:45;2;Caixin Manufacturing PMI (MoM)  (Jun)
2025.07.01 06:35;2;10-Year JGB Auction
2025.07.01 09:00;2;Nationwide HPI (YoY)  (Jun)
2025.07.01 09:00;2;Nationwide HPI (MoM)  (Jun)
2025.07.01 10:40;2;ECB's De Guindos Speaks
2025.07.01 11:00;2;HCOB Eurozone Manufacturing PMI  (Jun)
2025.07.01 11:30;2;S&P Global Manufacturing PMI  (Jun)
2025.07.01 11:40;2;ECB's Elderson Speaks
2025.07.01 12:00;2;Core CPI (YoY)  (Jun)
2025.07.01 12:00;2;CPI (MoM)  (Jun)
2025.07.01 12:00;3;CPI (YoY)  (Jun)
2025.07.01 13:40;2;ECB's Schnabel Speaks
2025.07.01 16:30;2;BoE Gov Bailey Speaks
2025.07.01 16:30;3;Fed Chair Powell Speaks
2025.07.01 16:30;2;ECB President Lagarde Speaks
2025.07.01 16:45;3;S&P Global Manufacturing PMI  (Jun)
2025.07.01 17:00;2;Construction Spending (MoM)  (May)
2025.07.01 17:00;2;ISM Manufacturing Employment  (Jun)
2025.07.01 17:00;3;ISM Manufacturing PMI  (Jun)
2025.07.01 17:00;3;ISM Manufacturing Prices  (Jun)
2025.07.01 17:00;3;JOLTS Job Openings  (May)
2025.07.01 19:30;2;Atlanta Fed GDPNow  (Q2)
2025.07.01 23:30;2;API Weekly Crude Oil Stock
2025.07.02 11:00;2;ECB's De Guindos Speaks
2025.07.02 12:00;2;Unemployment Rate  (May)
2025.07.02 13:30;2;ECB's Lane Speaks
2025.07.02 15:15;3;ADP Nonfarm Employment Change  (Jun)
2025.07.02 17:15;2;ECB President Lagarde Speaks
2025.07.02 17:30;3;Crude Oil Inventories
2025.07.02 17:30;2;Cushing Crude Oil Inventories
2025.07.03 03:30;2;au Jibun Bank Services PMI  (Jun)
2025.07.03 04:45;2;Caixin Services PMI  (Jun)
2025.07.03 11:00;2;HCOB Eurozone Composite PMI  (Jun)
2025.07.03 11:00;2;HCOB Eurozone Services PMI  (Jun)
2025.07.03 11:30;2;BOE Credit Conditions Survey
2025.07.03 11:30;2;S&P Global Composite PMI  (Jun)
2025.07.03 11:30;2;S&P Global Services PMI  (Jun)
2025.07.03 14:30;2;ECB Publishes Account of Monetary Policy Meeting
2025.07.03 15:30;2;Average Hourly Earnings (YoY) (YoY)  (Jun)
2025.07.03 15:30;3;Average Hourly Earnings (MoM)  (Jun)
2025.07.03 15:30;2;Continuing Jobless Claims
2025.07.03 15:30;2;Exports  (May)
2025.07.03 15:30;2;Imports  (May)
2025.07.03 15:30;3;Initial Jobless Claims
2025.07.03 15:30;3;Nonfarm Payrolls  (Jun)
2025.07.03 15:30;2;Participation Rate  (Jun)
2025.07.03 15:30;2;Private Nonfarm Payrolls  (Jun)
2025.07.03 15:30;2;Trade Balance  (May)
2025.07.03 15:30;2;U6 Unemployment Rate  (Jun)
2025.07.03 15:30;3;Unemployment Rate  (Jun)
2025.07.03 16:45;2;S&P Global Composite PMI  (Jun)
2025.07.03 16:45;3;S&P Global Services PMI  (Jun)
2025.07.03 17:00;2;Factory Orders (MoM)  (May)
2025.07.03 17:00;2;ISM Non-Manufacturing Employment  (Jun)
2025.07.03 17:00;3;ISM Non-Manufacturing PMI  (Jun)
2025.07.03 17:00;3;ISM Non-Manufacturing Prices  (Jun)
2025.07.03 18:00;2;FOMC Member Bostic Speaks
2025.07.03 20:00;2;Atlanta Fed GDPNow  (Q2)
2025.07.03 20:00;2;U.S. Baker Hughes Oil Rig Count
2025.07.03 20:00;2;U.S. Baker Hughes Total Rig Count
2025.07.03 23:30;2;Fed's Balance Sheet
2025.07.04 02:30;2;Household Spending (YoY)  (May)
2025.07.04 02:30;2;Household Spending (MoM)  (May)
2025.07.04 10:30;2;ECB President Lagarde Speaks
2025.07.04 11:00;2;ECB's Elderson Speaks
2025.07.04 11:30;2;S&P Global Construction PMI  (Jun)
2025.07.04 21:00;2;ECB President Lagarde Speaks
2025.07.05 13:00;2;OPEC Meeting
2025.07.05 18:45;2;BoE Gov Bailey Speaks
2025.07.07 09:00;2;Halifax House Price Index (YoY)  (Jun)
2025.07.07 09:00;2;Halifax House Price Index (MoM)  (Jun)
2025.07.07 11:30;2;Mortgage Rate (GBP)  (Jun)
2025.07.07 13:00;2;Eurogroup Meetings
2025.07.07 22:30;2;CFTC GBP speculative net positions
2025.07.07 22:30;2;CFTC Crude Oil speculative net positions
2025.07.07 22:30;2;CFTC Gold speculative net positions
2025.07.07 22:30;2;CFTC Nasdaq 100 speculative net positions
2025.07.07 22:30;2;CFTC S&P 500 speculative net positions
2025.07.07 22:30;2;CFTC JPY speculative net positions
2025.07.07 22:30;2;CFTC EUR speculative net positions
2025.07.08 02:50;2;Adjusted Current Account  (May)
2025.07.08 02:50;2;Current Account n.s.a.  (May)
2025.07.08 18:00;2;NY Fed 1-Year Consumer Inflation Expectations  (Jun)
2025.07.08 19:00;2;EIA Short-Term Energy Outlook
2025.07.08 20:00;2;3-Year Note Auction
2025.07.08 22:00;2;Consumer Credit  (May)
2025.07.08 23:30;2;API Weekly Crude Oil Stock
2025.07.09 04:30;2;CPI (MoM)  (Jun)
2025.07.09 04:30;2;CPI (YoY)  (Jun)
2025.07.09 04:30;2;PPI (YoY)  (Jun)
2025.07.09 09:00;2;BoE Financial Stability Report
2025.07.09 12:30;2;BoE Financial Stability Report
2025.07.09 13:45;2;ECB's Lane Speaks
2025.07.09 14:00;2;ECB's De Guindos Speaks
2025.07.09 17:30;3;Crude Oil Inventories
2025.07.09 17:30;2;Cushing Crude Oil Inventories
2025.07.09 20:00;3;10-Year Note Auction
2025.07.09 20:00;2;Atlanta Fed GDPNow  (Q2)
2025.07.09 21:00;3;FOMC Meeting Minutes
2025.07.10 15:30;2;Continuing Jobless Claims
2025.07.10 15:30;3;Initial Jobless Claims
2025.07.10 20:00;3;30-Year Bond Auction
2025.07.10 20:15;2;Fed Waller Speaks
2025.07.10 21:30;2;FOMC Member Daly Speaks
2025.07.10 23:30;2;Fed's Balance Sheet
2025.07.11 09:00;3;GDP (MoM)  (May)
2025.07.11 09:00;2;Industrial Production (MoM)  (May)
2025.07.11 09:00;2;Manufacturing Production (MoM)  (May)
2025.07.11 09:00;2;Monthly GDP 3M/3M Change  (May)
2025.07.11 09:00;2;Trade Balance  (May)
2025.07.11 09:00;2;Trade Balance Non-EU  (May)
2025.07.11 11:00;2;IEA Monthly Report
2025.07.11 15:00;2;NIESR Monthly GDP Tracker  (Jun)
2025.07.11 19:00;2;WASDE Report
2025.07.11 20:00;2;U.S. Baker Hughes Oil Rig Count
2025.07.11 20:00;2;U.S. Baker Hughes Total Rig Count
2025.07.11 21:00;2;Federal Budget Balance  (Jun)
2025.07.11 22:30;2;CFTC GBP speculative net positions
2025.07.11 22:30;2;CFTC Crude Oil speculative net positions
2025.07.11 22:30;2;CFTC Gold speculative net positions
2025.07.11 22:30;2;CFTC Nasdaq 100 speculative net positions
2025.07.11 22:30;2;CFTC S&P 500 speculative net positions
2025.07.11 22:30;2;CFTC JPY speculative net positions
2025.07.11 22:30;2;CFTC EUR speculative net positions
2025.07.14 06:00;2;Exports (YoY)  (Jun)
2025.07.14 06:00;2;Imports (YoY)  (Jun)
2025.07.14 06:00;2;Trade Balance (USD)  (Jun)
2025.07.14 07:30;2;Industrial Production (MoM)  (May)
2025.07.14 09:30;2;WPI Inflation (YoY)  (Jun)
2025.07.14 13:00;2;New Loans  (Jun)
2025.07.14 13:00;2;Eurogroup Meetings
2025.07.14 13:30;2;CPI (YoY)  (Jun)
2025.07.15 02:01;2;BRC Retail Sales Monitor (YoY)  (Jun)
2025.07.15 05:00;2;Fixed Asset Investment (YoY)  (Jun)
2025.07.15 05:00;2;GDP (QoQ)  (Q2)
2025.07.15 05:00;3;GDP (YoY)  (Q2)
2025.07.15 05:00;2;Chinese GDP YTD  (YoY)  (Q2)
2025.07.15 05:00;2;Industrial Production (YoY)  (Jun)
2025.07.15 05:00;2;Chinese Industrial Production YTD  (YoY)  (Jun)
2025.07.15 05:00;2;Chinese Unemployment Rate  (Jun)
2025.07.15 05:00;2;NBS Press Conference
2025.07.15 12:00;2;Industrial Production (MoM)  (May)
2025.07.15 12:00;2;ZEW Economic Sentiment  (Jul)
2025.07.15 14:00;2;OPEC Monthly Report
2025.07.15 15:30;2;Core CPI (YoY)  (Jun)
2025.07.15 15:30;3;Core CPI (MoM)  (Jun)
2025.07.15 15:30;3;CPI (MoM)  (Jun)
2025.07.15 15:30;3;CPI (YoY)  (Jun)
2025.07.15 15:30;2;NY Empire State Manufacturing Index  (Jul)
2025.07.15 16:15;2;FOMC Member Bowman Speaks
2025.07.15 19:45;2;Fed Vice Chair for Supervision Barr Speaks
2025.07.15 23:00;2;BoE Gov Bailey Speaks
2025.07.15 23:30;2;API Weekly Crude Oil Stock
2025.07.16 09:00;2;CPI (MoM)  (Jun)
2025.07.16 09:00;3;CPI (YoY)  (Jun)
2025.07.16 09:00;2;CPIH (YoY)
2025.07.16 12:00;2;Trade Balance  (May)
2025.07.16 15:30;2;Core PPI (MoM)  (Jun)
2025.07.16 15:30;3;PPI (MoM)  (Jun)
2025.07.16 16:15;2;Industrial Production (MoM)  (Jun)
2025.07.16 16:15;2;Industrial Production (YoY)  (Jun)
2025.07.16 17:30;3;Crude Oil Inventories
2025.07.16 17:30;2;Cushing Crude Oil Inventories
2025.07.16 21:00;2;Beige Book
2025.07.16 23:30;2;FOMC Member Williams Speaks
2025.07.17 02:50;2;Adjusted Trade Balance
2025.07.17 02:50;2;Exports (YoY)  (Jun)
2025.07.17 02:50;2;Trade Balance  (Jun)
2025.07.17 09:00;2;Average Earnings Index +Bonus  (May)
2025.07.17 09:00;2;Claimant Count Change  (Jun)
2025.07.17 09:00;2;Employment Change 3M/3M (MoM)  (May)
2025.07.17 09:00;2;Unemployment Rate  (May)
2025.07.17 12:00;2;Core CPI (YoY)  (Jun)
2025.07.17 12:00;2;CPI (MoM)  (Jun)
2025.07.17 12:00;3;CPI (YoY)  (Jun)
2025.07.17 15:30;2;Continuing Jobless Claims
2025.07.17 15:30;3;Core Retail Sales (MoM)  (Jun)
2025.07.17 15:30;2;Export Price Index (MoM)  (Jun)
2025.07.17 15:30;2;Import Price Index (MoM)  (Jun)
2025.07.17 15:30;3;Initial Jobless Claims
2025.07.17 15:30;3;Philadelphia Fed Manufacturing Index  (Jul)
2025.07.17 15:30;2;Philly Fed Employment  (Jul)
2025.07.17 15:30;2;Retail Control (MoM)  (Jun)
2025.07.17 15:30;3;Retail Sales (MoM)  (Jun)
2025.07.17 17:00;2;Business Inventories (MoM)  (May)
2025.07.17 17:00;2;Retail Inventories Ex Auto  (May)
2025.07.17 19:45;2;FOMC Member Daly Speaks
2025.07.17 20:00;2;Atlanta Fed GDPNow  (Q2)
2025.07.17 23:00;2;TIC Net Long-Term Transactions  (May)
2025.07.18 01:30;2;Fed Waller Speaks
2025.07.18 02:30;2;National Core CPI (YoY)  (Jun)
2025.07.18 15:30;2;Building Permits  (Jun)
2025.07.18 15:30;2;Housing Starts (MoM)  (Jun)
2025.07.18 15:30;2;Housing Starts  (Jun)
2025.07.18 17:00;2;Michigan 1-Year Inflation Expectations  (Jul)
2025.07.18 17:00;2;Michigan 5-Year Inflation Expectations  (Jul)
2025.07.18 17:00;2;Michigan Consumer Expectations  (Jul)
2025.07.18 17:00;2;Michigan Consumer Sentiment  (Jul)
2025.07.18 18:30;2;Atlanta Fed GDPNow  (Q2)
2025.07.18 20:00;2;U.S. Baker Hughes Oil Rig Count
2025.07.18 20:00;2;U.S. Baker Hughes Total Rig Count
2025.07.20 04:15;2;PBoC Loan Prime Rate
2025.07.21 04:00;2;China Loan Prime Rate 5Y  (Jul)
2025.07.21 17:00;2;US Leading Index (MoM)  (Jun)
2025.07.23 17:00;3;Existing Home Sales  (Jun)
2025.07.23 17:00;2;Existing Home Sales (MoM)  (Jun)
2025.07.24 03:30;2;au Jibun Bank Services PMI  (Jul)
2025.07.24 11:00;2;HCOB Eurozone Manufacturing PMI  (Jul)
2025.07.24 11:00;2;HCOB Eurozone Composite PMI  (Jul)
2025.07.24 11:00;2;HCOB Eurozone Services PMI  (Jul)
2025.07.24 11:30;2;S&P Global Composite PMI  (Jul)
2025.07.24 11:30;2;S&P Global Manufacturing PMI  (Jul)
2025.07.24 11:30;2;S&P Global Services PMI  (Jul)
2025.07.24 15:15;3;Deposit Facility Rate  (Jul)
2025.07.24 15:15;3;ECB Interest Rate Decision  (Jul)
2025.07.24 16:45;3;S&P Global Manufacturing PMI  (Jul)
2025.07.24 16:45;2;S&P Global Composite PMI  (Jul)
2025.07.24 16:45;3;S&P Global Services PMI  (Jul)
2025.07.24 17:00;3;New Home Sales  (Jun)
2025.07.24 17:00;2;New Home Sales (MoM)  (Jun)
2025.07.25 02:30;2;Tokyo Core CPI (YoY)  (Jul)
2025.07.25 09:00;2;Core Retail Sales (MoM)  (Jun)
2025.07.25 09:00;2;Core Retail Sales (YoY)  (Jun)
2025.07.25 09:00;2;Retail Sales (MoM)  (Jun)
2025.07.25 09:00;2;Retail Sales (YoY)  (Jun)
2025.07.25 15:30;2;Core Durable Goods Orders (MoM)  (Jun)
2025.07.25 15:30;3;Durable Goods Orders (MoM)  (Jun)
2025.07.25 18:30;2;Atlanta Fed GDPNow  (Q2)
2025.07.29 15:30;2;Goods Trade Balance  (Jun)
2025.07.29 15:30;2;Retail Inventories Ex Auto  (Jun)
2025.07.29 16:00;2;S&P/CS HPI Composite - 20 n.s.a. (YoY)  (May)
2025.07.29 16:00;2;S&P/CS HPI Composite - 20 n.s.a. (MoM)  (May)
2025.07.29 17:00;3;CB Consumer Confidence  (Jul)
2025.07.29 17:00;3;JOLTS Job Openings  (Jun)
2025.07.29 18:30;2;Atlanta Fed GDPNow  (Q2)
2025.07.30 06:00;3;BoJ Interest Rate Decision
2025.07.30 12:00;2;GDP (YoY)  (Q2)
2025.07.30 12:00;2;GDP (QoQ)  (Q2)
2025.07.30 15:15;3;ADP Nonfarm Employment Change  (Jul)
2025.07.30 15:30;2;Core PCE Prices  (Q2)
2025.07.30 15:30;3;GDP (QoQ)  (Q2)
2025.07.30 15:30;2;GDP Price Index (QoQ)  (Q2)
2025.07.30 17:00;2;Pending Home Sales (MoM)  (Jun)
2025.07.30 21:00;3;Fed Interest Rate Decision
2025.07.31 02:50;2;Industrial Production (MoM)  (Jun)
2025.07.31 04:30;2;Chinese Composite PMI  (Jul)
2025.07.31 04:30;3;Manufacturing PMI  (Jul)
2025.07.31 04:30;2;Non-Manufacturing PMI  (Jul)
2025.07.31 12:00;2;Unemployment Rate  (Jun)
2025.07.31 15:30;3;Core PCE Price Index (MoM)  (Jun)
2025.07.31 15:30;3;Core PCE Price Index (YoY)  (Jun)
2025.07.31 15:30;2;Employment Cost Index (QoQ)  (Q2)
2025.07.31 15:30;2;PCE Price index (YoY)  (Jun)
2025.07.31 15:30;2;PCE price index (MoM)  (Jun)
2025.07.31 15:30;2;Personal Spending (MoM)  (Jun)
2025.07.31 16:45;3;Chicago PMI  (Jul)
2025.07.31 18:30;2;Atlanta Fed GDPNow  (Q3)
2025.08.01 04:45;2;Caixin Manufacturing PMI (MoM)  (Jul)
2025.08.01 11:00;2;HCOB Eurozone Manufacturing PMI  (Jul)
2025.08.01 11:30;2;S&P Global Manufacturing PMI  (Jul)
2025.08.01 12:00;3;CPI (YoY)  (Jul)
2025.08.01 20:00;2;Atlanta Fed GDPNow  (Q3)
2025.08.05 20:00;2;Atlanta Fed GDPNow  (Q3)
2025.08.07 20:00;2;Atlanta Fed GDPNow  (Q3)
2025.08.12 14:00;2;OPEC Monthly Report
2025.08.15 20:00;2;Atlanta Fed GDPNow  (Q3)
2025.08.19 18:30;2;Atlanta Fed GDPNow  (Q3)
2025.08.26 18:30;2;Atlanta Fed GDPNow  (Q3)
2025.08.29 18:30;2;Atlanta Fed GDPNow  (Q3)
2025.09.02 20:00;2;Atlanta Fed GDPNow  (Q3)
2025.09.04 20:00;2;Atlanta Fed GDPNow  (Q3)
2025.09.10 20:00;2;Atlanta Fed GDPNow  (Q3)
2025.09.11 14:00;2;OPEC Monthly Report
2025.09.16 20:00;2;Atlanta Fed GDPNow  (Q3)
2025.09.17 18:30;2;Atlanta Fed GDPNow  (Q3)
2025.09.17 21:00;3;Fed Interest Rate Decision
2025.09.19 06:00;3;BoJ Interest Rate Decision
2025.09.26 18:30;2;Atlanta Fed GDPNow  (Q3)
2025.10.13 14:00;2;OPEC Monthly Report
2025.10.29 21:00;3;Fed Interest Rate Decision
2025.10.30 06:00;3;BoJ Interest Rate Decision
2025.11.12 15:00;2;OPEC Monthly Report
2025.12.10 22:00;3;Fed Interest Rate Decision
2025.12.11 15:00;2;OPEC Monthly Report
2025.12.19 06:00;3;BoJ Interest Rate Decision
