2025.02.27 18:00;2;Fed Vice Chair for Supervision Barr Speaks
2025.02.27 18:00;2;Pending Home Sales (MoM)  (Jan)
2025.02.27 19:45;2;FOMC Member Bowman Speaks
2025.02.27 23:15;2;FOMC Member Harker Speaks
2025.02.28 00:30;2;Fed's Balance Sheet
2025.02.28 02:30;2;Tokyo Core CPI (YoY)  (Feb)
2025.02.28 02:50;2;Industrial Production (MoM)  (Jan)
2025.02.28 10:00;2;MPC Member Ramsden Speaks
2025.02.28 10:00;2;Nationwide HPI (YoY)  (Feb)
2025.02.28 10:00;2;Nationwide HPI (MoM)  (Feb)
2025.02.28 13:30;2;GDP Quarterly (YoY)  (Q3)
2025.02.28 16:30;3;Core PCE Price Index (YoY)  (Jan)
2025.02.28 16:30;3;Core PCE Price Index (MoM)  (Jan)
2025.02.28 16:30;2;Goods Trade Balance  (Jan)
2025.02.28 16:30;2;PCE Price index (YoY)  (Jan)
2025.02.28 16:30;2;PCE price index (MoM)  (Jan)
2025.02.28 16:30;2;Personal Spending (MoM)  (Jan)
2025.02.28 16:30;2;Retail Inventories Ex Auto  (Jan)
2025.02.28 17:45;3;Chicago PMI  (Feb)
2025.02.28 19:05;2;Atlanta Fed GDPNow  (Q1)
2025.02.28 21:00;2;U.S. Baker Hughes Oil Rig Count
2025.02.28 21:00;2;U.S. Baker Hughes Total Rig Count
2025.02.28 23:30;2;CFTC GBP speculative net positions
2025.02.28 23:30;2;CFTC Crude Oil speculative net positions
2025.02.28 23:30;2;CFTC Gold speculative net positions
2025.02.28 23:30;2;CFTC Nasdaq 100 speculative net positions
2025.02.28 23:30;2;CFTC S&P 500 speculative net positions
2025.02.28 23:30;2;CFTC JPY speculative net positions
2025.02.28 23:30;2;CFTC EUR speculative net positions
2025.03.01 04:30;2;Chinese Composite PMI  (Feb)
2025.03.01 04:30;3;Manufacturing PMI  (Feb)
2025.03.01 04:30;2;Non-Manufacturing PMI  (Feb)
2025.03.03 13:00;2;Core CPI (YoY)  (Feb)
2025.03.03 13:00;2;CPI (MoM)  (Feb)
2025.03.03 13:00;3;CPI (YoY)  (Feb)
2025.03.03 18:00;2;Construction Spending (MoM)  (Jan)
2025.03.03 18:00;2;ISM Manufacturing Employment  (Feb)
2025.03.03 18:00;3;ISM Manufacturing PMI  (Feb)
2025.03.03 18:00;3;ISM Manufacturing Prices  (Feb)
2025.03.03 21:00;2;Atlanta Fed GDPNow  (Q1)
2025.03.04 02:50;2;Capital Spending (YoY)  (Q4)
2025.03.04 06:35;2;10-Year JGB Auction
2025.03.04 13:00;2;Unemployment Rate  (Jan)
2025.03.04 22:20;2;FOMC Member Williams Speaks
2025.03.05 00:30;2;API Weekly Crude Oil Stock
2025.03.05 05:10;3;U.S. President Trump Speaks
2025.03.05 16:15;3;ADP Nonfarm Employment Change  (Feb)
2025.03.05 17:30;2;BoE Gov Bailey Speaks
2025.03.05 17:30;2;BoE MPC Member Pill Speaks
2025.03.05 17:30;2;BoE MPC Treasury Committee Hearings
2025.03.05 18:00;2;Factory Orders (MoM)  (Jan)
2025.03.05 18:00;2;ISM Non-Manufacturing Employment  (Feb)
2025.03.05 18:00;3;ISM Non-Manufacturing PMI  (Feb)
2025.03.05 18:00;3;ISM Non-Manufacturing Prices  (Feb)
2025.03.05 18:30;3;Crude Oil Inventories
2025.03.05 18:30;2;Cushing Crude Oil Inventories
2025.03.05 22:00;2;Beige Book
2025.03.06 13:00;2;EU Leaders Summit
2025.03.06 13:00;2;Euro Summit
2025.03.06 16:15;3;Deposit Facility Rate  (Mar)
2025.03.06 16:15;2;ECB Marginal Lending Facility
2025.03.06 16:15;2;ECB Monetary Policy Statement
2025.03.06 16:15;3;ECB Interest Rate Decision  (Mar)
2025.03.06 16:30;2;Continuing Jobless Claims
2025.03.06 16:30;2;Exports  (Jan)
2025.03.06 16:30;2;Imports  (Jan)
2025.03.06 16:30;3;Initial Jobless Claims
2025.03.06 16:30;2;Nonfarm Productivity (QoQ)  (Q4)
2025.03.06 16:30;2;Trade Balance  (Jan)
2025.03.06 16:30;2;Unit Labor Costs (QoQ)  (Q4)
2025.03.06 16:45;2;FOMC Member Harker Speaks
2025.03.06 16:45;3;ECB Press Conference
2025.03.06 18:15;2;ECB President Lagarde Speaks
2025.03.06 21:00;2;Atlanta Fed GDPNow  (Q1)
2025.03.06 23:15;2;BoE MPC Member Mann Speaks
2025.03.06 23:30;2;Fed Waller Speaks
2025.03.07 00:30;2;Fed's Balance Sheet
2025.03.07 03:00;2;FOMC Member Bostic Speaks
2025.03.07 06:20;2;Exports (YoY)  (Feb)
2025.03.07 06:20;2;Imports (YoY)  (Feb)
2025.03.07 06:20;2;Trade Balance (USD)  (Feb)
2025.03.07 10:00;2;Halifax House Price Index (YoY)  (Feb)
2025.03.07 10:00;2;Halifax House Price Index (MoM)  (Feb)
2025.03.07 12:30;2;Mortgage Rate (GBP)  (Feb)
2025.03.07 12:30;2;ECB President Lagarde Speaks
2025.03.07 13:00;2;GDP (QoQ)  (Q4)
2025.03.07 13:00;2;GDP (YoY)  (Q4)
2025.03.07 16:30;2;Average Hourly Earnings (YoY) (YoY)  (Feb)
2025.03.07 16:30;3;Average Hourly Earnings (MoM)  (Feb)
2025.03.07 16:30;3;Nonfarm Payrolls  (Feb)
2025.03.07 16:30;2;Participation Rate  (Feb)
2025.03.07 16:30;2;Private Nonfarm Payrolls  (Feb)
2025.03.07 16:30;2;U6 Unemployment Rate  (Feb)
2025.03.07 16:30;3;Unemployment Rate  (Feb)
2025.03.07 18:00;2;BoE MPC Member Mann Speaks
2025.03.07 18:15;2;FOMC Member Bowman Speaks
2025.03.07 18:45;2;FOMC Member Williams Speaks
2025.03.07 20:30;3;Fed Chair Powell Speaks
2025.03.07 21:00;2;U.S. Baker Hughes Oil Rig Count
2025.03.07 21:00;2;U.S. Baker Hughes Total Rig Count
2025.03.07 21:30;3;U.S. President Trump Speaks
2025.03.07 23:00;2;Consumer Credit  (Jan)
2025.03.07 23:15;2;BoE MPC Member Mann Speaks
2025.03.07 23:30;2;CFTC GBP speculative net positions
2025.03.07 23:30;2;CFTC Crude Oil speculative net positions
2025.03.07 23:30;2;CFTC Gold speculative net positions
2025.03.07 23:30;2;CFTC Nasdaq 100 speculative net positions
2025.03.07 23:30;2;CFTC S&P 500 speculative net positions
2025.03.07 23:30;2;CFTC JPY speculative net positions
2025.03.07 23:30;2;CFTC EUR speculative net positions
2025.03.09 04:30;2;CPI (MoM)  (Feb)
2025.03.09 04:30;2;CPI (YoY)  (Feb)
2025.03.09 04:30;2;PPI (YoY)  (Feb)
2025.03.10 02:50;2;Adjusted Current Account  (Jan)
2025.03.10 02:50;2;Current Account n.s.a.  (Jan)
2025.03.10 13:00;2;Eurogroup Meetings
2025.03.10 18:00;2;NY Fed 1-Year Consumer Inflation Expectations
2025.03.11 02:30;2;Household Spending (YoY)  (Jan)
2025.03.11 02:30;2;Household Spending (MoM)  (Jan)
2025.03.11 02:50;2;GDP (YoY)  (Q4)
2025.03.11 02:50;3;GDP (QoQ)  (Q4)
2025.03.11 02:50;2;GDP Annualized (QoQ)  (Q4)
2025.03.11 02:50;2;GDP Price Index (YoY)  (Q4)
2025.03.11 03:01;2;BRC Retail Sales Monitor (YoY)  (Feb)
2025.03.11 13:00;2;Eurogroup Meetings
2025.03.11 17:00;3;JOLTS Job Openings  (Jan)
2025.03.11 19:00;2;EIA Short-Term Energy Outlook
2025.03.11 19:00;2;WASDE Report
2025.03.11 20:00;2;3-Year Note Auction
2025.03.11 23:30;2;API Weekly Crude Oil Stock
2025.03.12 02:50;2;BSI Large Manufacturing Conditions  (Q1)
2025.03.12 11:45;2;ECB President Lagarde Speaks
2025.03.12 13:30;2;CPI (YoY)  (Feb)
2025.03.12 14:00;2;OPEC Monthly Report
2025.03.12 15:30;3;Core CPI (MoM)  (Feb)
2025.03.12 15:30;2;Core CPI (YoY)  (Feb)
2025.03.12 15:30;3;CPI (YoY)  (Feb)
2025.03.12 15:30;3;CPI (MoM)  (Feb)
2025.03.12 16:30;3;Crude Oil Inventories
2025.03.12 16:30;2;Cushing Crude Oil Inventories
2025.03.12 18:15;2;ECB's Lane Speaks
2025.03.12 20:00;3;10-Year Note Auction
2025.03.12 21:00;2;Federal Budget Balance  (Feb)
2025.03.13 12:00;2;IEA Monthly Report
2025.03.13 12:50;2;ECB's De Guindos Speaks
2025.03.13 13:00;2;Industrial Production (MoM)  (Jan)
2025.03.13 15:30;2;Continuing Jobless Claims
2025.03.13 15:30;2;Core PPI (MoM)  (Feb)
2025.03.13 15:30;3;Initial Jobless Claims
2025.03.13 15:30;3;PPI (MoM)  (Feb)
2025.03.13 20:00;3;30-Year Bond Auction
2025.03.13 20:00;2;ECB President Lagarde Speaks
2025.03.13 23:30;2;Fed's Balance Sheet
2025.03.14 10:00;3;GDP (MoM)  (Jan)
2025.03.14 10:00;2;Industrial Production (MoM)  (Jan)
2025.03.14 10:00;2;Manufacturing Production (MoM)  (Jan)
2025.03.14 10:00;2;Monthly GDP 3M/3M Change  (Jan)
2025.03.14 12:00;2;New Loans  (Feb)
2025.03.14 14:00;2;NIESR Monthly GDP Tracker  (Feb)
2025.03.14 17:00;2;Michigan 1-Year Inflation Expectations  (Mar)
2025.03.14 17:00;2;Michigan 5-Year Inflation Expectations  (Mar)
2025.03.14 17:00;2;Michigan Consumer Expectations  (Mar)
2025.03.14 17:00;2;Michigan Consumer Sentiment  (Mar)
2025.03.14 20:00;2;U.S. Baker Hughes Oil Rig Count
2025.03.14 20:00;2;U.S. Baker Hughes Total Rig Count
2025.03.14 22:30;2;CFTC GBP speculative net positions
2025.03.14 22:30;2;CFTC Crude Oil speculative net positions
2025.03.14 22:30;2;CFTC Nasdaq 100 speculative net positions
2025.03.14 22:30;2;CFTC S&P 500 speculative net positions
2025.03.14 22:30;2;CFTC JPY speculative net positions
2025.03.14 22:30;2;CFTC EUR speculative net positions
2025.03.14 23:30;2;CFTC Gold speculative net positions
2025.03.15 19:30;2;ECB President Lagarde Speaks
2025.03.17 05:00;2;Fixed Asset Investment (YoY)  (Feb)
2025.03.17 05:00;2;Industrial Production (YoY)  (Feb)
2025.03.17 05:00;2;Chinese Industrial Production YTD  (YoY)  (Feb)
2025.03.17 05:00;2;Chinese Unemployment Rate  (Feb)
2025.03.17 05:00;2;NBS Press Conference
2025.03.17 09:30;2;WPI Inflation (YoY)  (Feb)
2025.03.17 15:30;3;Core Retail Sales (MoM)  (Feb)
2025.03.17 15:30;2;NY Empire State Manufacturing Index  (Mar)
2025.03.17 15:30;2;Retail Control (MoM)  (Feb)
2025.03.17 15:30;3;Retail Sales (MoM)  (Feb)
2025.03.17 17:00;2;Business Inventories (MoM)  (Jan)
2025.03.17 17:00;2;Retail Inventories Ex Auto  (Jan)
2025.03.17 17:00;2;ECB President Lagarde Speaks
2025.03.17 20:00;2;Atlanta Fed GDPNow  (Q1)
2025.03.18 13:00;2;Trade Balance  (Jan)
2025.03.18 13:00;2;ZEW Economic Sentiment  (Mar)
2025.03.18 15:30;2;Building Permits  (Feb)
2025.03.18 15:30;2;Export Price Index (MoM)  (Feb)
2025.03.18 15:30;2;Housing Starts (MoM)  (Feb)
2025.03.18 15:30;2;Housing Starts  (Feb)
2025.03.18 15:30;2;Import Price Index (MoM)  (Feb)
2025.03.18 16:15;2;Industrial Production (YoY)  (Feb)
2025.03.18 16:15;2;Industrial Production (MoM)  (Feb)
2025.03.18 19:30;2;Atlanta Fed GDPNow  (Q1)
2025.03.18 20:30;2;20-Year Bond Auction
2025.03.18 23:30;2;API Weekly Crude Oil Stock
2025.03.19 02:50;2;Adjusted Trade Balance
2025.03.19 02:50;2;Exports (YoY)  (Feb)
2025.03.19 02:50;2;Trade Balance  (Feb)
2025.03.19 05:30;2;BoJ Monetary Policy Statement
2025.03.19 05:30;3;BoJ Interest Rate Decision
2025.03.19 07:30;2;Industrial Production (MoM)  (Jan)
2025.03.19 09:30;2;BoJ Press Conference
2025.03.19 13:00;2;Core CPI (YoY)  (Feb)
2025.03.19 13:00;2;CPI (MoM)  (Feb)
2025.03.19 13:00;3;CPI (YoY)  (Feb)
2025.03.19 13:00;2;Wages in euro zone (YoY)  (Q4)
2025.03.19 15:00;2;ECB's De Guindos Speaks
2025.03.19 16:00;2;ECB's Elderson Speaks
2025.03.19 16:30;3;Crude Oil Inventories
2025.03.19 16:30;2;Cushing Crude Oil Inventories
2025.03.19 21:00;2;Interest Rate Projection - 1st Yr  (Q1)
2025.03.19 21:00;2;Interest Rate Projection - 2nd Yr  (Q1)
2025.03.19 21:00;2;Interest Rate Projection - Current  (Q1)
2025.03.19 21:00;2;Interest Rate Projection - Longer  (Q1)
2025.03.19 21:00;3;FOMC Economic Projections
2025.03.19 21:00;3;FOMC Statement
2025.03.19 21:00;3;Fed Interest Rate Decision
2025.03.19 21:30;3;FOMC Press Conference
2025.03.19 23:00;2;TIC Net Long-Term Transactions  (Jan)
2025.03.20 04:00;2;China Loan Prime Rate 5Y  (Mar)
2025.03.20 04:00;2;PBoC Loan Prime Rate
2025.03.20 10:00;2;Average Earnings Index +Bonus  (Jan)
2025.03.20 10:00;2;Claimant Count Change  (Feb)
2025.03.20 10:00;2;Employment Change 3M/3M (MoM)  (Jan)
2025.03.20 10:00;2;Unemployment Rate  (Jan)
2025.03.20 11:00;2;ECB President Lagarde Speaks
2025.03.20 12:00;2;ECB Economic Bulletin
2025.03.20 13:00;2;EU Leaders Summit
2025.03.20 14:00;2;ECB Economic Bulletin
2025.03.20 15:00;2;BOE Inflation Letter
2025.03.20 15:00;2;BoE MPC vote cut  (Mar)
2025.03.20 15:00;2;BoE MPC vote hike  (Mar)
2025.03.20 15:00;2;BoE MPC vote unchanged  (Mar)
2025.03.20 15:00;3;BoE Interest Rate Decision  (Mar)
2025.03.20 15:00;2;BoE MPC Meeting Minutes
2025.03.20 15:00;2;ECB's Lane Speaks
2025.03.20 15:30;2;BoE Gov Bailey Speaks
2025.03.20 15:30;2;Continuing Jobless Claims
2025.03.20 15:30;2;Current Account  (Q4)
2025.03.20 15:30;3;Initial Jobless Claims
2025.03.20 15:30;3;Philadelphia Fed Manufacturing Index  (Mar)
2025.03.20 15:30;2;Philly Fed Employment  (Mar)
2025.03.20 17:00;3;Existing Home Sales  (Feb)
2025.03.20 17:00;2;Existing Home Sales (MoM)  (Feb)
2025.03.20 17:00;2;US Leading Index (MoM)  (Feb)
2025.03.20 20:00;2;10-Year TIPS Auction
2025.03.20 23:30;2;Fed's Balance Sheet
2025.03.21 02:30;2;National Core CPI (YoY)  (Feb)
2025.03.21 02:30;2;National CPI (MoM)  (Feb)
2025.03.21 13:00;2;EU Leaders Summit
2025.03.21 16:05;2;FOMC Member Williams Speaks
2025.03.21 20:00;2;U.S. Baker Hughes Oil Rig Count
2025.03.21 20:00;2;U.S. Baker Hughes Total Rig Count
2025.03.21 22:30;2;CFTC GBP speculative net positions
2025.03.21 22:30;2;CFTC Crude Oil speculative net positions
2025.03.21 22:30;2;CFTC Gold speculative net positions
2025.03.21 22:30;2;CFTC Nasdaq 100 speculative net positions
2025.03.21 22:30;2;CFTC S&P 500 speculative net positions
2025.03.21 22:30;2;CFTC JPY speculative net positions
2025.03.21 22:30;2;CFTC EUR speculative net positions
2025.03.24 20:45;2;FOMC Member Bostic Speaks
2025.03.24 21:00;2;BoE Gov Bailey Speaks
2025.03.24 22:10;2;Fed Vice Chair for Supervision Barr Speaks
2025.03.25 02:50;2;Monetary Policy Meeting Minutes
2025.03.25 08:00;2;BoJ Core CPI (YoY)
2025.03.25 14:40;2;Building Permits  (Feb)
2025.03.25 16:00;2;S&P/CS HPI Composite - 20 n.s.a. (YoY)  (Jan)
2025.03.25 16:00;2;S&P/CS HPI Composite - 20 n.s.a. (MoM)  (Jan)
2025.03.25 16:05;2;FOMC Member Williams Speaks
2025.03.25 17:00;3;CB Consumer Confidence  (Mar)
2025.03.25 17:00;2;New Home Sales (MoM)  (Feb)
2025.03.25 17:00;3;New Home Sales  (Feb)
2025.03.25 20:00;2;2-Year Note Auction
2025.03.25 21:35;2;FOMC Member Williams Speaks
2025.03.25 23:30;2;API Weekly Crude Oil Stock
2025.03.26 10:00;3;CPI (YoY)  (Feb)
2025.03.26 10:00;2;CPI (MoM)  (Feb)
2025.03.26 10:00;2;CPIH (YoY)
2025.03.26 11:00;2;European Central Bank Non-monetary Policy Meeting
2025.03.26 13:00;3;Spring Forecast Statement
2025.03.26 15:30;2;Core Durable Goods Orders (MoM)  (Feb)
2025.03.26 15:30;3;Durable Goods Orders (MoM)  (Feb)
2025.03.26 17:00;2;FOMC Member Kashkari Speaks
2025.03.26 17:30;2;Atlanta Fed GDPNow  (Q1)
2025.03.26 17:30;3;Crude Oil Inventories
2025.03.26 17:30;2;Cushing Crude Oil Inventories
2025.03.26 20:00;2;5-Year Note Auction
2025.03.27 04:00;3;U.S. President Trump Speaks
2025.03.27 13:00;2;EU Economic Forecasts
2025.03.27 15:30;2;Continuing Jobless Claims
2025.03.27 15:30;2;Core PCE Prices  (Q4)
2025.03.27 15:30;3;GDP (QoQ)  (Q4)
2025.03.27 15:30;2;GDP Price Index (QoQ)  (Q4)
2025.03.27 15:30;2;Goods Trade Balance  (Feb)
2025.03.27 15:30;3;Initial Jobless Claims
2025.03.27 15:30;2;Retail Inventories Ex Auto  (Feb)
2025.03.27 16:00;2;ECB's De Guindos Speaks
2025.03.27 17:00;2;Pending Home Sales (MoM)  (Feb)
2025.03.27 20:00;2;7-Year Note Auction
2025.03.27 20:40;2;ECB's Schnabel Speaks
2025.03.27 21:05;2;ECB President Lagarde Speaks
2025.03.27 23:30;2;Fed's Balance Sheet
2025.03.28 02:30;2;Tokyo Core CPI (YoY)  (Mar)
2025.03.28 10:00;2;Business Investment (QoQ)  (Q4)
2025.03.28 10:00;2;Core Retail Sales (MoM)  (Feb)
2025.03.28 10:00;2;Core Retail Sales (YoY)  (Feb)
2025.03.28 10:00;2;Current Account  (Q4)
2025.03.28 10:00;3;GDP (YoY)  (Q4)
2025.03.28 10:00;3;GDP (QoQ)  (Q4)
2025.03.28 10:00;2;Retail Sales (YoY)  (Feb)
2025.03.28 10:00;2;Retail Sales (MoM)  (Feb)
2025.03.28 10:00;2;Trade Balance  (Jan)
2025.03.28 10:00;2;Trade Balance Non-EU  (Jan)
2025.03.28 11:30;2;ECB's De Guindos Speaks
2025.03.28 15:30;3;Core PCE Price Index (MoM)  (Feb)
2025.03.28 15:30;3;Core PCE Price Index (YoY)  (Feb)
2025.03.28 15:30;2;PCE Price index (YoY)  (Feb)
2025.03.28 15:30;2;PCE price index (MoM)  (Feb)
2025.03.28 15:30;2;Personal Spending (MoM)  (Feb)
2025.03.28 17:00;2;Michigan 1-Year Inflation Expectations  (Mar)
2025.03.28 17:00;2;Michigan 5-Year Inflation Expectations  (Mar)
2025.03.28 17:00;2;Michigan Consumer Expectations  (Mar)
2025.03.28 17:00;2;Michigan Consumer Sentiment  (Mar)
2025.03.28 18:30;2;Atlanta Fed GDPNow  (Q1)
2025.03.28 19:15;2;Fed Vice Chair for Supervision Barr Speaks
2025.03.28 20:00;2;U.S. Baker Hughes Oil Rig Count
2025.03.28 20:00;2;U.S. Baker Hughes Total Rig Count
2025.03.28 22:30;2;CFTC GBP speculative net positions
2025.03.28 22:30;2;CFTC Crude Oil speculative net positions
2025.03.28 22:30;2;CFTC Gold speculative net positions
2025.03.28 22:30;2;CFTC Nasdaq 100 speculative net positions
2025.03.28 22:30;2;CFTC S&P 500 speculative net positions
2025.03.28 22:30;2;CFTC JPY speculative net positions
2025.03.28 22:30;2;CFTC EUR speculative net positions
2025.03.28 22:45;2;FOMC Member Bostic Speaks
2025.03.31 02:50;2;Industrial Production (MoM)  (Feb)
2025.03.31 04:30;2;Chinese Composite PMI  (Mar)
2025.03.31 04:30;3;Manufacturing PMI  (Mar)
2025.03.31 04:30;2;Non-Manufacturing PMI  (Mar)
2025.03.31 16:45;3;Chicago PMI  (Mar)
2025.04.01 02:50;2;Tankan All Big Industry CAPEX  (Q1)
2025.04.01 02:50;2;Tankan Big Manufacturing Outlook Index  (Q1)
2025.04.01 02:50;2;Tankan Large Manufacturers Index  (Q1)
2025.04.01 02:50;2;Tankan Large Non-Manufacturers Index  (Q1)
2025.04.01 09:00;2;Nationwide HPI (MoM)  (Mar)
2025.04.01 09:00;2;Nationwide HPI (YoY)  (Mar)
2025.04.01 12:00;2;Core CPI (YoY)  (Mar)
2025.04.01 12:00;2;CPI (MoM)  (Mar)
2025.04.01 12:00;3;CPI (YoY)  (Mar)
2025.04.01 12:00;2;Unemployment Rate  (Feb)
2025.04.01 15:30;2;ECB President Lagarde Speaks
2025.04.01 17:00;2;Construction Spending (MoM)  (Feb)
2025.04.01 17:00;2;ISM Manufacturing Employment  (Mar)
2025.04.01 17:00;3;ISM Manufacturing PMI  (Mar)
2025.04.01 17:00;3;ISM Manufacturing Prices  (Mar)
2025.04.01 17:00;3;JOLTS Job Openings  (Feb)
2025.04.01 19:30;2;ECB's Lane Speaks
2025.04.01 20:00;2;Atlanta Fed GDPNow  (Q1)
2025.04.01 23:30;2;API Weekly Crude Oil Stock
2025.04.02 13:30;2;ECB's Schnabel Speaks
2025.04.02 15:15;3;ADP Nonfarm Employment Change  (Mar)
2025.04.02 17:00;2;Factory Orders (MoM)  (Feb)
2025.04.02 17:05;2;ECB's Lane Speaks
2025.04.02 17:30;3;Crude Oil Inventories
2025.04.02 17:30;2;Cushing Crude Oil Inventories
2025.04.02 21:45;2;ECB President Lagarde Speaks
2025.04.02 23:00;3;U.S. President Trump Speaks
2025.04.03 06:35;2;10-Year JGB Auction
2025.04.03 10:20;2;ECB's De Guindos Speaks
2025.04.03 13:00;2;OPEC Meeting
2025.04.03 13:00;2;ECB's Schnabel Speaks
2025.04.03 14:30;2;ECB Publishes Account of Monetary Policy Meeting
2025.04.03 15:30;2;Continuing Jobless Claims
2025.04.03 15:30;2;Exports  (Feb)
2025.04.03 15:30;2;Imports  (Feb)
2025.04.03 15:30;3;Initial Jobless Claims
2025.04.03 15:30;2;Trade Balance  (Feb)
2025.04.03 17:00;2;ISM Non-Manufacturing Employment  (Mar)
2025.04.03 17:00;3;ISM Non-Manufacturing PMI  (Mar)
2025.04.03 17:00;3;ISM Non-Manufacturing Prices  (Mar)
2025.04.03 19:30;2;Atlanta Fed GDPNow  (Q1)
2025.04.03 23:30;2;Fed's Balance Sheet
2025.04.04 02:30;2;Household Spending (MoM)  (Feb)
2025.04.04 02:30;2;Household Spending (YoY)  (Feb)
2025.04.04 11:00;2;ECB's De Guindos Speaks
2025.04.04 15:30;3;Average Hourly Earnings (MoM)  (Mar)
2025.04.04 15:30;2;Average Hourly Earnings (YoY) (YoY)  (Mar)
2025.04.04 15:30;3;Nonfarm Payrolls  (Mar)
2025.04.04 15:30;2;Participation Rate  (Mar)
2025.04.04 15:30;2;Private Nonfarm Payrolls  (Mar)
2025.04.04 15:30;2;U6 Unemployment Rate  (Mar)
2025.04.04 15:30;3;Unemployment Rate  (Mar)
2025.04.04 18:25;3;Fed Chair Powell Speaks
2025.04.04 19:00;2;Fed Vice Chair for Supervision Barr Speaks
2025.04.04 19:45;2;Fed Waller Speaks
2025.04.04 20:00;2;U.S. Baker Hughes Oil Rig Count
2025.04.04 20:00;2;U.S. Baker Hughes Total Rig Count
2025.04.04 22:30;2;CFTC GBP speculative net positions
2025.04.04 22:30;2;CFTC Crude Oil speculative net positions
2025.04.04 22:30;2;CFTC Gold speculative net positions
2025.04.04 22:30;2;CFTC Nasdaq 100 speculative net positions
2025.04.04 22:30;2;CFTC S&P 500 speculative net positions
2025.04.04 22:30;2;CFTC JPY speculative net positions
2025.04.04 22:30;2;CFTC EUR speculative net positions
2025.04.05 12:15;2;ECB's Schnabel Speaks
2025.04.07 09:00;2;Halifax House Price Index (MoM)  (Mar)
2025.04.07 09:00;2;Halifax House Price Index (YoY)  (Mar)
2025.04.07 15:00;2;Mortgage Rate (GBP)  (Mar)
2025.04.07 22:00;2;Consumer Credit  (Feb)
2025.04.08 02:50;2;Adjusted Current Account  (Feb)
2025.04.08 02:50;2;Current Account n.s.a.  (Feb)
2025.04.08 12:00;2;ECB's De Guindos Speaks
2025.04.08 19:00;2;EIA Short-Term Energy Outlook
2025.04.08 20:00;2;3-Year Note Auction
2025.04.08 21:00;2;FOMC Member Daly Speaks
2025.04.08 23:30;2;API Weekly Crude Oil Stock
2025.04.09 07:30;2;Interest Rate Decision
2025.04.09 07:30;2;RBI MPC Meeting Minutes
2025.04.09 17:30;3;Crude Oil Inventories
2025.04.09 17:30;2;Cushing Crude Oil Inventories
2025.04.09 20:00;3;10-Year Note Auction
2025.04.09 21:00;3;FOMC Meeting Minutes
2025.04.10 04:30;2;CPI (MoM)  (Mar)
2025.04.10 04:30;2;CPI (YoY)  (Mar)
2025.04.10 04:30;2;PPI (YoY)  (Mar)
2025.04.10 11:30;2;BOE Credit Conditions Survey
2025.04.10 12:15;2;ECB Supervisory Board Member Tuominen Speaks
2025.04.10 15:30;2;Continuing Jobless Claims
2025.04.10 15:30;3;Core CPI (MoM)  (Mar)
2025.04.10 15:30;2;Core CPI (YoY)  (Mar)
2025.04.10 15:30;3;CPI (MoM)  (Mar)
2025.04.10 15:30;3;CPI (YoY)  (Mar)
2025.04.10 15:30;3;Initial Jobless Claims
2025.04.10 17:00;2;FOMC Member Bowman Speaks
2025.04.10 19:00;2;WASDE Report
2025.04.10 19:30;2;FOMC Member Harker Speaks
2025.04.10 20:00;3;30-Year Bond Auction
2025.04.10 21:00;2;Federal Budget Balance  (Mar)
2025.04.10 23:30;2;Fed's Balance Sheet
2025.04.11 09:00;3;GDP (MoM)  (Feb)
2025.04.11 09:00;2;Industrial Production (MoM)  (Feb)
2025.04.11 09:00;2;Manufacturing Production (MoM)  (Feb)
2025.04.11 09:00;2;Monthly GDP 3M/3M Change  (Feb)
2025.04.11 09:00;2;Trade Balance  (Feb)
2025.04.11 09:00;2;Trade Balance Non-EU  (Feb)
2025.04.11 12:45;2;ECB President Lagarde Speaks
2025.04.11 13:00;2;Eurogroup Meetings
2025.04.11 13:30;2;NIESR Monthly GDP Tracker  (Mar)
2025.04.11 15:30;2;Core PPI (MoM)  (Mar)
2025.04.11 15:30;3;PPI (MoM)  (Mar)
2025.04.11 17:00;2;Michigan 1-Year Inflation Expectations  (Apr)
2025.04.11 17:00;2;Michigan 5-Year Inflation Expectations  (Apr)
2025.04.11 17:00;2;Michigan Consumer Expectations  (Apr)
2025.04.11 17:00;2;Michigan Consumer Sentiment  (Apr)
2025.04.11 18:00;2;FOMC Member Williams Speaks
2025.04.11 20:00;2;U.S. Baker Hughes Oil Rig Count
2025.04.11 20:00;2;U.S. Baker Hughes Total Rig Count
2025.04.11 22:30;2;CFTC GBP speculative net positions
2025.04.11 22:30;2;CFTC Crude Oil speculative net positions
2025.04.11 22:30;2;CFTC Gold speculative net positions
2025.04.11 22:30;2;CFTC Nasdaq 100 speculative net positions
2025.04.11 22:30;2;CFTC S&P 500 speculative net positions
2025.04.11 22:30;2;CFTC JPY speculative net positions
2025.04.11 22:30;2;CFTC EUR speculative net positions
2025.04.12 13:00;2;Eurogroup Meetings
2025.04.13 12:00;2;New Loans  (Mar)
2025.04.14 06:00;2;Exports (YoY)  (Mar)
2025.04.14 06:00;2;Imports (YoY)  (Mar)
2025.04.14 06:00;2;Trade Balance (USD)  (Mar)
2025.04.14 07:30;2;Industrial Production (MoM)  (Feb)
2025.04.14 14:00;2;OPEC Monthly Report
2025.04.14 18:00;2;NY Fed 1-Year Consumer Inflation Expectations  (Mar)
2025.04.14 20:00;2;Fed Waller Speaks
2025.04.15 01:00;2;FOMC Member Harker Speaks
2025.04.15 02:01;2;BRC Retail Sales Monitor (YoY)  (Mar)
2025.04.15 02:40;2;FOMC Member Bostic Speaks
2025.04.15 09:00;2;Average Earnings Index +Bonus  (Feb)
2025.04.15 09:00;2;Claimant Count Change  (Mar)
2025.04.15 09:00;2;Employment Change 3M/3M (MoM)  (Feb)
2025.04.15 09:00;2;Unemployment Rate  (Feb)
2025.04.15 09:30;2;WPI Inflation (YoY)  (Mar)
2025.04.15 11:00;2;IEA Monthly Report
2025.04.15 12:00;2;Industrial Production (MoM)  (Feb)
2025.04.15 12:00;2;ZEW Economic Sentiment  (Apr)
2025.04.15 13:30;2;CPI (YoY)  (Mar)
2025.04.15 15:30;2;Export Price Index (MoM)  (Mar)
2025.04.15 15:30;2;Import Price Index (MoM)  (Mar)
2025.04.15 15:30;2;NY Empire State Manufacturing Index  (Apr)
2025.04.15 19:00;2;ECB President Lagarde Speaks
2025.04.15 23:30;2;API Weekly Crude Oil Stock
2025.04.16 05:00;2;Fixed Asset Investment (YoY)  (Mar)
2025.04.16 05:00;2;GDP (QoQ)  (Q1)
2025.04.16 05:00;3;GDP (YoY)  (Q1)
2025.04.16 05:00;2;Chinese GDP YTD  (YoY)  (Q1)
2025.04.16 05:00;2;Industrial Production (YoY)  (Mar)
2025.04.16 05:00;2;Chinese Industrial Production YTD  (YoY)  (Mar)
2025.04.16 05:00;2;Chinese Unemployment Rate  (Mar)
2025.04.16 05:00;2;NBS Press Conference
2025.04.16 09:00;3;CPI (YoY)  (Mar)
2025.04.16 09:00;2;CPI (MoM)  (Mar)
2025.04.16 12:00;2;Core CPI (YoY)  (Mar)
2025.04.16 12:00;2;CPI (MoM)  (Mar)
2025.04.16 12:00;3;CPI (YoY)  (Mar)
2025.04.16 15:30;3;Core Retail Sales (MoM)  (Mar)
2025.04.16 15:30;2;Retail Control (MoM)  (Mar)
2025.04.16 15:30;3;Retail Sales (MoM)  (Mar)
2025.04.16 16:15;2;Industrial Production (YoY)  (Mar)
2025.04.16 16:15;2;Industrial Production (MoM)  (Mar)
2025.04.16 17:00;2;Business Inventories (MoM)  (Feb)
2025.04.16 17:00;2;Retail Inventories Ex Auto  (Feb)
2025.04.16 17:30;3;Crude Oil Inventories
2025.04.16 17:30;2;Cushing Crude Oil Inventories
2025.04.16 20:00;2;20-Year Bond Auction
2025.04.16 20:00;2;Atlanta Fed GDPNow  (Q1)
2025.04.16 20:30;3;Fed Chair Powell Speaks
2025.04.16 23:00;2;TIC Net Long-Term Transactions  (Feb)
2025.04.17 02:50;2;Adjusted Trade Balance
2025.04.17 02:50;2;Exports (YoY)  (Mar)
2025.04.17 02:50;2;Trade Balance  (Mar)
2025.04.17 04:30;2;BoJ Board Member Nakagawa Speaks
2025.04.17 11:30;2;BOE Credit Conditions Survey
2025.04.17 15:15;3;Deposit Facility Rate  (Apr)
2025.04.17 15:15;2;ECB Marginal Lending Facility
2025.04.17 15:15;2;ECB Monetary Policy Statement
2025.04.17 15:15;3;ECB Interest Rate Decision  (Apr)
2025.04.17 15:30;2;Building Permits  (Mar)
2025.04.17 15:30;2;Continuing Jobless Claims
2025.04.17 15:30;2;Housing Starts (MoM)  (Mar)
2025.04.17 15:30;2;Housing Starts  (Mar)
2025.04.17 15:30;3;Initial Jobless Claims
2025.04.17 15:30;3;Philadelphia Fed Manufacturing Index  (Apr)
2025.04.17 15:30;2;Philly Fed Employment  (Apr)
2025.04.17 15:45;3;ECB Press Conference
2025.04.17 17:15;2;ECB President Lagarde Speaks
2025.04.17 17:30;2;Atlanta Fed GDPNow  (Q1)
2025.04.17 18:30;2;5-Year TIPS Auction
2025.04.17 18:45;2;Fed Vice Chair for Supervision Barr Speaks
2025.04.17 20:00;2;U.S. Baker Hughes Oil Rig Count
2025.04.17 20:00;2;U.S. Baker Hughes Total Rig Count
2025.04.17 23:30;2;Fed's Balance Sheet
2025.04.18 02:30;2;National Core CPI (YoY)  (Mar)
2025.04.18 02:30;2;National CPI (MoM)  (Mar)
2025.04.18 18:00;2;FOMC Member Daly Speaks
