2025.01.01 00:30;2;API Weekly Crude Oil Stock
2025.01.02 10:00;2;Nationwide HPI (YoY)  (Dec)
2025.01.02 10:00;2;Nationwide HPI (MoM)  (Dec)
2025.01.02 16:30;2;Continuing Jobless Claims
2025.01.02 16:30;3;Initial Jobless Claims
2025.01.02 18:00;2;Construction Spending (MoM)  (Nov)
2025.01.02 19:00;3;Crude Oil Inventories
2025.01.02 19:00;2;Cushing Crude Oil Inventories
2025.01.02 20:00;2;Atlanta Fed GDPNow  (Q4)
2025.01.03 01:45;2;Fed's Balance Sheet
2025.01.03 18:00;2;ISM Manufacturing Employment  (Dec)
2025.01.03 18:00;3;ISM Manufacturing PMI  (Dec)
2025.01.03 18:00;3;ISM Manufacturing Prices  (Dec)
2025.01.03 19:00;2;Atlanta Fed GDPNow  (Q4)
2025.01.03 19:00;2;ECB's Lane Speaks
2025.01.03 21:00;2;U.S. Baker Hughes Oil Rig Count
2025.01.03 21:00;2;U.S. Baker Hughes Total Rig Count
2025.01.04 19:00;2;ECB's Lane Speaks
2025.01.05 01:30;2;FOMC Member Daly Speaks
2025.01.05 21:15;2;FOMC Member Daly Speaks
2025.01.06 18:00;2;Factory Orders (MoM)  (Nov)
2025.01.06 21:00;2;3-Year Note Auction
2025.01.06 23:30;2;CFTC GBP speculative net positions
2025.01.06 23:30;2;CFTC Crude Oil speculative net positions
2025.01.06 23:30;2;CFTC Gold speculative net positions
2025.01.06 23:30;2;CFTC Nasdaq 100 speculative net positions
2025.01.06 23:30;2;CFTC S&P 500 speculative net positions
2025.01.06 23:30;2;CFTC JPY speculative net positions
2025.01.06 23:30;2;CFTC EUR speculative net positions
2025.01.07 03:01;2;BRC Retail Sales Monitor (YoY)  (Dec)
2025.01.07 06:35;2;10-Year JGB Auction
2025.01.07 10:00;2;Halifax House Price Index (MoM)  (Dec)
2025.01.07 10:00;2;Halifax House Price Index (YoY)  (Dec)
2025.01.07 13:00;2;Core CPI (YoY)  (Dec)
2025.01.07 13:00;3;CPI (YoY)  (Dec)
2025.01.07 13:00;2;CPI (MoM)  (Dec)
2025.01.07 13:00;2;Unemployment Rate  (Nov)
2025.01.07 16:30;2;Exports  (Nov)
2025.01.07 16:30;2;Imports  (Nov)
2025.01.07 16:30;2;Trade Balance  (Nov)
2025.01.07 18:00;2;ISM Non-Manufacturing Employment  (Dec)
2025.01.07 18:00;3;ISM Non-Manufacturing PMI  (Dec)
2025.01.07 18:00;3;ISM Non-Manufacturing Prices  (Dec)
2025.01.07 18:00;3;JOLTS Job Openings  (Nov)
2025.01.07 21:00;3;10-Year Note Auction
2025.01.07 21:00;2;Atlanta Fed GDPNow  (Q4)
2025.01.08 00:30;2;API Weekly Crude Oil Stock
2025.01.08 12:30;2;Mortgage Rate (GBP)  (Dec)
2025.01.08 13:05;2;BoE Deputy Governor Woods Speaks
2025.01.08 16:15;3;ADP Nonfarm Employment Change  (Dec)
2025.01.08 16:30;2;Continuing Jobless Claims
2025.01.08 16:30;2;Fed Waller Speaks
2025.01.08 16:30;3;Initial Jobless Claims
2025.01.08 18:30;3;Crude Oil Inventories
2025.01.08 18:30;2;Cushing Crude Oil Inventories
2025.01.08 21:00;3;30-Year Bond Auction
2025.01.08 22:00;3;FOMC Meeting Minutes
2025.01.08 23:00;2;Consumer Credit  (Nov)
2025.01.09 04:30;2;CPI (MoM)  (Dec)
2025.01.09 04:30;2;CPI (YoY)  (Dec)
2025.01.09 04:30;2;PPI (YoY)  (Dec)
2025.01.09 12:00;2;ECB Economic Bulletin
2025.01.09 17:00;2;FOMC Member Harker Speaks
2025.01.09 19:30;2;Atlanta Fed GDPNow  (Q4)
2025.01.09 21:35;2;FOMC Member Bowman Speaks
2025.01.10 02:30;2;Household Spending (YoY)  (Nov)
2025.01.10 02:30;2;Household Spending (MoM)  (Nov)
2025.01.10 16:30;2;Average Hourly Earnings (YoY) (YoY)  (Dec)
2025.01.10 16:30;3;Average Hourly Earnings (MoM)  (Dec)
2025.01.10 16:30;3;Nonfarm Payrolls  (Dec)
2025.01.10 16:30;2;Participation Rate  (Dec)
2025.01.10 16:30;2;Private Nonfarm Payrolls  (Dec)
2025.01.10 16:30;2;U6 Unemployment Rate  (Dec)
2025.01.10 16:30;3;Unemployment Rate  (Dec)
2025.01.10 18:00;2;Michigan 1-Year Inflation Expectations  (Jan)
2025.01.10 18:00;2;Michigan 5-Year Inflation Expectations  (Jan)
2025.01.10 18:00;2;Michigan Consumer Expectations  (Jan)
2025.01.10 18:00;2;Michigan Consumer Sentiment  (Jan)
2025.01.10 20:00;2;WASDE Report
2025.01.10 21:00;2;U.S. Baker Hughes Oil Rig Count
2025.01.10 21:00;2;U.S. Baker Hughes Total Rig Count
2025.01.11 00:30;2;Fed's Balance Sheet
2025.01.13 06:00;2;Exports (YoY)  (Dec)
2025.01.13 06:01;2;Imports (YoY)  (Dec)
2025.01.13 06:02;2;Trade Balance (USD)  (Dec)
2025.01.13 06:15;2;ECB's Lane Speaks
2025.01.13 13:30;2;CPI (YoY)  (Dec)
2025.01.13 19:00;2;NY Fed 1-Year Consumer Inflation Expectations  (Dec)
2025.01.13 23:30;2;CFTC GBP speculative net positions
2025.01.13 23:30;2;CFTC Crude Oil speculative net positions
2025.01.13 23:30;2;CFTC Gold speculative net positions
2025.01.13 23:30;2;CFTC Nasdaq 100 speculative net positions
2025.01.13 23:30;2;CFTC S&P 500 speculative net positions
2025.01.13 23:30;2;CFTC JPY speculative net positions
2025.01.13 23:30;2;CFTC EUR speculative net positions
2025.01.14 02:50;2;Adjusted Current Account  (Nov)
2025.01.14 02:50;2;Current Account n.s.a.  (Nov)
2025.01.14 09:30;2;WPI Inflation (YoY)  (Dec)
2025.01.14 10:15;2;New Loans  (Dec)
2025.01.14 10:35;2;ECB's Lane Speaks
2025.01.14 16:30;2;Core PPI (MoM)  (Dec)
2025.01.14 16:30;3;PPI (MoM)  (Dec)
2025.01.14 20:00;2;EIA Short-Term Energy Outlook
2025.01.14 22:00;2;Federal Budget Balance  (Dec)
2025.01.14 23:05;2;FOMC Member Williams Speaks
2025.01.15 00:30;2;API Weekly Crude Oil Stock
2025.01.15 06:15;2;ECB's Lane Speaks
2025.01.15 10:00;3;CPI (YoY)  (Dec)
2025.01.15 10:00;2;CPI (MoM)  (Dec)
2025.01.15 10:00;2;CPIH (YoY)
2025.01.15 10:00;2;PPI Input (MoM)  (Dec)
2025.01.15 11:00;2;ECB's De Guindos Speaks
2025.01.15 12:00;2;IEA Monthly Report
2025.01.15 13:00;2;Industrial Production (MoM)  (Nov)
2025.01.15 15:00;2;OPEC Monthly Report
2025.01.15 16:30;3;Core CPI (MoM)  (Dec)
2025.01.15 16:30;2;Core CPI (YoY)  (Dec)
2025.01.15 16:30;3;CPI (MoM)  (Dec)
2025.01.15 16:30;3;CPI (YoY)  (Dec)
2025.01.15 16:30;2;NY Empire State Manufacturing Index  (Jan)
2025.01.15 18:00;2;FOMC Member Kashkari Speaks
2025.01.15 18:30;3;Crude Oil Inventories
2025.01.15 18:30;2;Cushing Crude Oil Inventories
2025.01.15 19:00;2;FOMC Member Williams Speaks
2025.01.15 22:00;2;Beige Book
2025.01.16 10:00;3;GDP (MoM)  (Nov)
2025.01.16 10:00;2;Industrial Production (MoM)  (Nov)
2025.01.16 10:00;2;Manufacturing Production (MoM)  (Nov)
2025.01.16 10:00;2;Monthly GDP 3M/3M Change  (Nov)
2025.01.16 10:00;2;Trade Balance  (Nov)
2025.01.16 10:00;2;Trade Balance Non-EU  (Nov)
2025.01.16 12:30;2;BOE Credit Conditions Survey
2025.01.16 13:00;2;Trade Balance  (Nov)
2025.01.16 15:00;2;NIESR Monthly GDP Tracker  (Dec)
2025.01.16 15:30;2;ECB Publishes Account of Monetary Policy Meeting
2025.01.16 16:30;2;Continuing Jobless Claims
2025.01.16 16:30;3;Core Retail Sales (MoM)  (Dec)
2025.01.16 16:30;2;Export Price Index (MoM)  (Dec)
2025.01.16 16:30;2;Import Price Index (MoM)  (Dec)
2025.01.16 16:30;3;Initial Jobless Claims
2025.01.16 16:30;3;Philadelphia Fed Manufacturing Index  (Jan)
2025.01.16 16:30;2;Philly Fed Employment  (Jan)
2025.01.16 16:30;2;Retail Control (MoM)  (Dec)
2025.01.16 16:30;3;Retail Sales (MoM)  (Dec)
2025.01.16 18:00;2;Business Inventories (MoM)  (Nov)
2025.01.16 18:00;2;Retail Inventories Ex Auto  (Nov)
2025.01.16 19:00;2;FOMC Member Williams Speaks
2025.01.16 21:00;2;Atlanta Fed GDPNow  (Q4)
2025.01.17 00:30;2;Fed's Balance Sheet
2025.01.17 05:00;2;Fixed Asset Investment (YoY)  (Dec)
2025.01.17 05:00;2;GDP (QoQ)  (Q4)
2025.01.17 05:00;3;GDP (YoY)  (Q4)
2025.01.17 05:00;2;Chinese GDP YTD  (YoY)  (Q4)
2025.01.17 05:00;2;Industrial Production (YoY)  (Dec)
2025.01.17 05:00;2;Chinese Industrial Production YTD  (YoY)  (Dec)
2025.01.17 05:00;2;Chinese Unemployment Rate  (Dec)
2025.01.17 05:00;2;NBS Press Conference
2025.01.17 10:00;2;Core Retail Sales (YoY)  (Dec)
2025.01.17 10:00;2;Core Retail Sales (MoM)  (Dec)
2025.01.17 10:00;2;Retail Sales (YoY)  (Dec)
2025.01.17 10:00;2;Retail Sales (MoM)  (Dec)
2025.01.17 13:00;2;Core CPI (YoY)  (Dec)
2025.01.17 13:00;2;CPI (MoM)  (Dec)
2025.01.17 13:00;3;CPI (YoY)  (Dec)
2025.01.17 16:30;2;Building Permits  (Dec)
2025.01.17 16:30;2;Housing Starts  (Dec)
2025.01.17 16:30;2;Housing Starts (MoM)  (Dec)
2025.01.17 17:15;2;Industrial Production (MoM)  (Dec)
2025.01.17 17:15;2;Industrial Production (YoY)  (Dec)
2025.01.17 20:00;2;BoE Deputy Governor Woods Speaks
2025.01.17 20:00;2;BoE Gov Bailey Speaks
2025.01.17 20:15;2;Atlanta Fed GDPNow  (Q4)
2025.01.17 21:00;2;U.S. Baker Hughes Oil Rig Count
2025.01.17 21:00;2;U.S. Baker Hughes Total Rig Count
2025.01.17 23:30;2;CFTC GBP speculative net positions
2025.01.17 23:30;2;CFTC Crude Oil speculative net positions
2025.01.17 23:30;2;CFTC Gold speculative net positions
2025.01.17 23:30;2;CFTC Nasdaq 100 speculative net positions
2025.01.17 23:30;2;CFTC S&P 500 speculative net positions
2025.01.17 23:30;2;CFTC JPY speculative net positions
2025.01.17 23:30;2;CFTC EUR speculative net positions
2025.01.18 00:00;2;TIC Net Long-Term Transactions  (Nov)
2025.01.20 04:00;2;China Loan Prime Rate 5Y  (Jan)
2025.01.20 04:00;2;PBoC Loan Prime Rate  (Jan)
2025.01.20 07:30;2;Industrial Production (MoM)  (Nov)
2025.01.20 13:00;2;Eurogroup Meetings
2025.01.20 20:00;3;U.S. President Trump Speaks
2025.01.21 10:00;2;Average Earnings Index +Bonus  (Nov)
2025.01.21 10:00;2;Claimant Count Change  (Dec)
2025.01.21 10:00;2;Employment Change 3M/3M (MoM)  (Nov)
2025.01.21 10:00;2;Unemployment Rate  (Nov)
2025.01.21 13:00;2;Eurogroup Meetings
2025.01.21 13:00;2;ZEW Economic Sentiment  (Jan)
2025.01.22 18:00;2;US Leading Index (MoM)  (Dec)
2025.01.22 18:15;2;ECB President Lagarde Speaks
2025.01.22 21:00;2;20-Year Bond Auction
2025.01.23 00:30;2;API Weekly Crude Oil Stock
2025.01.23 02:50;2;Adjusted Trade Balance
2025.01.23 02:50;2;Exports (YoY)  (Dec)
2025.01.23 02:50;2;Trade Balance  (Dec)
2025.01.23 16:30;2;Continuing Jobless Claims
2025.01.23 16:30;3;Initial Jobless Claims
2025.01.23 19:00;3;U.S. President Trump Speaks
2025.01.23 20:00;3;Crude Oil Inventories
2025.01.23 20:00;2;Cushing Crude Oil Inventories
2025.01.23 21:00;2;10-Year TIPS Auction
2025.01.24 00:30;2;Fed's Balance Sheet
2025.01.24 02:30;2;National Core CPI (YoY)  (Dec)
2025.01.24 02:30;2;National CPI (MoM)  (Dec)
2025.01.24 05:30;2;BoJ Monetary Policy Statement
2025.01.24 06:00;2;BoJ Outlook Report (YoY)
2025.01.24 06:20;3;BoJ Interest Rate Decision
2025.01.24 09:30;2;BoJ Press Conference
2025.01.24 13:00;2;ECB President Lagarde Speaks
2025.01.24 18:00;2;Existing Home Sales (MoM)  (Dec)
2025.01.24 18:00;3;Existing Home Sales  (Dec)
2025.01.24 18:00;2;Michigan 1-Year Inflation Expectations  (Jan)
2025.01.24 18:00;2;Michigan 5-Year Inflation Expectations  (Jan)
2025.01.24 18:00;2;Michigan Consumer Expectations  (Jan)
2025.01.24 18:00;2;Michigan Consumer Sentiment  (Jan)
2025.01.24 21:00;2;U.S. Baker Hughes Oil Rig Count
2025.01.24 21:00;2;U.S. Baker Hughes Total Rig Count
2025.01.24 23:30;2;CFTC GBP speculative net positions
2025.01.24 23:30;2;CFTC Crude Oil speculative net positions
2025.01.24 23:30;2;CFTC Gold speculative net positions
2025.01.24 23:30;2;CFTC Nasdaq 100 speculative net positions
2025.01.24 23:30;2;CFTC S&P 500 speculative net positions
2025.01.24 23:30;2;CFTC JPY speculative net positions
2025.01.24 23:30;2;CFTC EUR speculative net positions
2025.01.27 04:30;2;Chinese Composite PMI  (Jan)
2025.01.27 04:30;3;Manufacturing PMI  (Jan)
2025.01.27 04:30;2;Non-Manufacturing PMI  (Jan)
2025.01.27 11:10;2;ECB President Lagarde Speaks
2025.01.27 15:30;2;Building Permits  (Dec)
2025.01.27 18:00;3;New Home Sales  (Dec)
2025.01.27 18:00;2;New Home Sales (MoM)  (Dec)
2025.01.27 18:35;2;ECB President Lagarde Speaks
2025.01.27 19:30;2;2-Year Note Auction
2025.01.27 21:00;2;5-Year Note Auction
2025.01.28 08:00;2;BoJ Core CPI (YoY)
2025.01.28 16:30;2;Core Durable Goods Orders (MoM)  (Dec)
2025.01.28 16:30;3;Durable Goods Orders (MoM)  (Dec)
2025.01.28 17:00;2;S&P/CS HPI Composite - 20 n.s.a. (MoM)  (Nov)
2025.01.28 17:00;2;S&P/CS HPI Composite - 20 n.s.a. (YoY)  (Nov)
2025.01.28 18:00;3;CB Consumer Confidence  (Jan)
2025.01.28 19:30;2;Atlanta Fed GDPNow  (Q4)
2025.01.28 20:00;2;ECB President Lagarde Speaks
2025.01.28 21:00;2;7-Year Note Auction
2025.01.29 00:30;2;API Weekly Crude Oil Stock
2025.01.29 02:50;2;Monetary Policy Meeting Minutes
2025.01.29 16:30;2;Goods Trade Balance  (Dec)
2025.01.29 16:30;2;Retail Inventories Ex Auto  (Dec)
2025.01.29 17:15;2;BoE Gov Bailey Speaks
2025.01.29 18:30;2;Atlanta Fed GDPNow  (Q4)
2025.01.29 18:30;3;Crude Oil Inventories
2025.01.29 18:30;2;Cushing Crude Oil Inventories
2025.01.29 22:00;3;FOMC Statement
2025.01.29 22:00;3;Fed Interest Rate Decision
2025.01.29 22:30;3;FOMC Press Conference
2025.01.30 13:00;2;GDP (YoY)  (Q4)
2025.01.30 13:00;2;GDP (QoQ)  (Q4)
2025.01.30 13:00;2;Unemployment Rate  (Dec)
2025.01.30 16:15;3;Deposit Facility Rate  (Jan)
2025.01.30 16:15;2;ECB Marginal Lending Facility
2025.01.30 16:15;2;ECB Monetary Policy Statement
2025.01.30 16:15;3;ECB Interest Rate Decision  (Jan)
2025.01.30 16:30;2;Continuing Jobless Claims
2025.01.30 16:30;2;Core PCE Prices  (Q4)
2025.01.30 16:30;3;GDP (QoQ)  (Q4)
2025.01.30 16:30;2;GDP Price Index (QoQ)  (Q4)
2025.01.30 16:30;3;Initial Jobless Claims
2025.01.30 16:45;3;ECB Press Conference
2025.01.30 18:00;2;Pending Home Sales (MoM)  (Dec)
2025.01.30 18:15;2;ECB President Lagarde Speaks
2025.01.31 00:30;2;Fed's Balance Sheet
2025.01.31 02:30;2;Tokyo Core CPI (YoY)  (Jan)
2025.01.31 02:50;2;Industrial Production (MoM)  (Dec)
2025.01.31 10:00;2;Nationwide HPI (YoY)  (Jan)
2025.01.31 10:00;2;Nationwide HPI (MoM)  (Jan)
2025.01.31 16:30;3;Core PCE Price Index (MoM)  (Dec)
2025.01.31 16:30;3;Core PCE Price Index (YoY)  (Dec)
2025.01.31 16:30;2;Employment Cost Index (QoQ)  (Q4)
2025.01.31 16:30;2;FOMC Member Bowman Speaks
2025.01.31 16:30;2;PCE price index (MoM)  (Dec)
2025.01.31 16:30;2;PCE Price index (YoY)  (Dec)
2025.01.31 16:30;2;Personal Spending (MoM)  (Dec)
2025.01.31 17:45;3;Chicago PMI  (Jan)
2025.01.31 18:30;2;Atlanta Fed GDPNow  (Q1)
2025.01.31 21:00;2;U.S. Baker Hughes Oil Rig Count
2025.01.31 21:00;2;U.S. Baker Hughes Total Rig Count
2025.01.31 23:30;2;CFTC GBP speculative net positions
2025.01.31 23:30;2;CFTC Crude Oil speculative net positions
2025.01.31 23:30;2;CFTC Gold speculative net positions
2025.01.31 23:30;2;CFTC Nasdaq 100 speculative net positions
2025.01.31 23:30;2;CFTC S&P 500 speculative net positions
2025.01.31 23:30;2;CFTC JPY speculative net positions
2025.01.31 23:30;2;CFTC EUR speculative net positions
2025.02.01 09:00;2;Indian Union Budget
2025.02.03 13:00;2;OPEC Meeting
2025.02.03 13:00;2;Core CPI (YoY)  (Jan)
2025.02.03 13:00;3;CPI (YoY)  (Jan)
2025.02.03 13:00;2;CPI (MoM)  (Jan)
2025.02.03 18:00;2;Construction Spending (MoM)  (Dec)
2025.02.03 18:00;2;ISM Manufacturing Employment  (Jan)
2025.02.03 18:00;3;ISM Manufacturing PMI  (Jan)
2025.02.03 18:00;3;ISM Manufacturing Prices  (Jan)
2025.02.03 20:00;2;Atlanta Fed GDPNow  (Q1)
2025.02.03 20:30;2;FOMC Member Bostic Speaks
2025.02.04 06:35;2;10-Year JGB Auction
2025.02.04 18:00;2;Factory Orders (MoM)  (Dec)
2025.02.04 18:00;3;JOLTS Job Openings  (Dec)
2025.02.04 19:00;2;FOMC Member Bostic Speaks
2025.02.04 21:15;2;FOMC Member Daly Speaks
2025.02.05 00:30;2;API Weekly Crude Oil Stock
2025.02.05 16:15;3;ADP Nonfarm Employment Change  (Jan)
2025.02.05 16:30;2;Exports  (Dec)
2025.02.05 16:30;2;Imports  (Dec)
2025.02.05 16:30;2;Trade Balance  (Dec)
2025.02.05 17:00;2;ECB's Lane Speaks
2025.02.05 18:00;2;ISM Non-Manufacturing Employment  (Jan)
2025.02.05 18:00;3;ISM Non-Manufacturing PMI  (Jan)
2025.02.05 18:00;3;ISM Non-Manufacturing Prices  (Jan)
2025.02.05 18:30;3;Crude Oil Inventories
2025.02.05 18:30;2;Cushing Crude Oil Inventories
2025.02.05 20:30;2;Atlanta Fed GDPNow  (Q1)
2025.02.05 23:00;2;FOMC Member Bowman Speaks
2025.02.06 15:00;2;BoE MPC vote cut  (Feb)
2025.02.06 15:00;2;BoE MPC vote hike  (Feb)
2025.02.06 15:00;2;BoE MPC vote unchanged  (Feb)
2025.02.06 15:00;3;BoE Interest Rate Decision  (Feb)
2025.02.06 15:00;2;BoE MPC Meeting Minutes
2025.02.06 16:30;2;Continuing Jobless Claims
2025.02.06 16:30;3;Initial Jobless Claims
2025.02.06 16:30;2;Nonfarm Productivity (QoQ)  (Q4)
2025.02.06 16:30;2;Unit Labor Costs (QoQ)  (Q4)
2025.02.06 17:15;2;BoE Gov Bailey Speaks
2025.02.06 22:30;2;Fed Waller Speaks
2025.02.06 23:30;2;FOMC Member Daly Speaks
2025.02.07 00:05;2;BoE Gov Bailey Speaks
2025.02.07 00:30;2;Fed's Balance Sheet
2025.02.07 02:30;2;Household Spending (MoM)  (Dec)
2025.02.07 02:30;2;Household Spending (YoY)  (Dec)
2025.02.07 07:30;2;Interest Rate Decision
2025.02.07 10:00;2;Halifax House Price Index (MoM)  (Jan)
2025.02.07 10:00;2;Halifax House Price Index (YoY)  (Jan)
2025.02.07 11:45;2;ECB's De Guindos Speaks
2025.02.07 12:30;2;Mortgage Rate (GBP)  (Jan)
2025.02.07 15:15;2;BoE MPC Member Pill Speaks
2025.02.07 16:30;2;Average Hourly Earnings (YoY) (YoY)  (Jan)
2025.02.07 16:30;3;Average Hourly Earnings (MoM)  (Jan)
2025.02.07 16:30;3;Nonfarm Payrolls  (Jan)
2025.02.07 16:30;2;Participation Rate  (Jan)
2025.02.07 16:30;2;Payrolls Benchmark, n.s.a.
2025.02.07 16:30;2;Private Nonfarm Payrolls  (Jan)
2025.02.07 16:30;2;U6 Unemployment Rate  (Jan)
2025.02.07 16:30;3;Unemployment Rate  (Jan)
2025.02.07 17:25;2;FOMC Member Bowman Speaks
2025.02.07 18:00;3;Fed Monetary Policy Report
2025.02.07 18:00;2;Michigan 1-Year Inflation Expectations  (Feb)
2025.02.07 18:00;2;Michigan 5-Year Inflation Expectations  (Feb)
2025.02.07 18:00;2;Michigan Consumer Expectations  (Feb)
2025.02.07 18:00;2;Michigan Consumer Sentiment  (Feb)
2025.02.07 20:00;2;Atlanta Fed GDPNow  (Q1)
2025.02.07 21:00;2;U.S. Baker Hughes Oil Rig Count
2025.02.07 21:00;2;U.S. Baker Hughes Total Rig Count
2025.02.07 23:00;2;Consumer Credit  (Dec)
2025.02.07 23:30;2;CFTC GBP speculative net positions
2025.02.07 23:30;2;CFTC Crude Oil speculative net positions
2025.02.07 23:30;2;CFTC Gold speculative net positions
2025.02.07 23:30;2;CFTC Nasdaq 100 speculative net positions
2025.02.07 23:30;2;CFTC S&P 500 speculative net positions
2025.02.07 23:30;2;CFTC JPY speculative net positions
2025.02.07 23:30;2;CFTC EUR speculative net positions
2025.02.09 04:30;2;CPI (YoY)  (Jan)
2025.02.09 04:30;2;CPI (MoM)  (Jan)
2025.02.09 04:30;2;PPI (YoY)  (Jan)
2025.02.10 02:50;2;Adjusted Current Account  (Dec)
2025.02.10 02:50;2;Current Account n.s.a.  (Dec)
2025.02.10 17:00;2;ECB President Lagarde Speaks
2025.02.10 19:00;2;NY Fed 1-Year Consumer Inflation Expectations  (Jan)
2025.02.11 03:01;2;BRC Retail Sales Monitor (YoY)  (Jan)
2025.02.11 11:45;2;BoE MPC Member Mann Speaks
2025.02.11 15:15;2;BoE Gov Bailey Speaks
2025.02.11 18:00;3;Fed Chair Powell Testifies
2025.02.11 20:00;2;EIA Short-Term Energy Outlook
2025.02.11 20:00;2;WASDE Report
2025.02.11 20:00;2;ECB's Schnabel Speaks
2025.02.11 21:00;2;3-Year Note Auction
2025.02.11 23:30;2;FOMC Member Bowman Speaks
2025.02.11 23:30;2;FOMC Member Williams Speaks
2025.02.12 00:30;2;API Weekly Crude Oil Stock
2025.02.12 13:00;2;ECB's Elderson Speaks
2025.02.12 13:30;2;CPI (YoY)  (Jan)
2025.02.12 15:00;2;OPEC Monthly Report
2025.02.12 16:30;2;Core CPI (YoY)  (Jan)
2025.02.12 16:30;3;Core CPI (MoM)  (Jan)
2025.02.12 16:30;3;CPI (MoM)  (Jan)
2025.02.12 16:30;3;CPI (YoY)  (Jan)
2025.02.12 18:00;3;Fed Chair Powell Testifies
2025.02.12 18:30;3;Crude Oil Inventories
2025.02.12 18:30;2;Cushing Crude Oil Inventories
2025.02.12 20:00;2;FOMC Member Bostic Speaks
2025.02.12 21:00;3;10-Year Note Auction
2025.02.12 22:00;2;Federal Budget Balance  (Jan)
2025.02.13 01:05;2;Fed Waller Speaks
2025.02.13 10:00;2;Business Investment (QoQ)  (Q4)
2025.02.13 10:00;3;GDP (QoQ)  (Q4)
2025.02.13 10:00;3;GDP (YoY)  (Q4)
2025.02.13 10:00;3;GDP (MoM)  (Dec)
2025.02.13 10:00;2;Industrial Production (MoM)  (Dec)
2025.02.13 10:00;2;Manufacturing Production (MoM)  (Dec)
2025.02.13 10:00;2;Monthly GDP 3M/3M Change  (Dec)
2025.02.13 10:00;2;Trade Balance  (Dec)
2025.02.13 10:00;2;Trade Balance Non-EU  (Dec)
2025.02.13 12:00;2;IEA Monthly Report
2025.02.13 12:00;2;ECB Economic Bulletin
2025.02.13 13:00;2;EU Economic Forecasts
2025.02.13 13:00;2;Industrial Production (MoM)  (Dec)
2025.02.13 15:45;2;NIESR Monthly GDP Tracker  (Jan)
2025.02.13 16:30;2;Continuing Jobless Claims
2025.02.13 16:30;2;Core PPI (MoM)  (Jan)
2025.02.13 16:30;3;Initial Jobless Claims
2025.02.13 16:30;3;PPI (MoM)  (Jan)
2025.02.13 21:00;3;30-Year Bond Auction
2025.02.14 00:30;2;Fed's Balance Sheet
2025.02.14 09:30;2;WPI Inflation (YoY)  (Jan)
2025.02.14 12:00;2;New Loans  (Jan)
2025.02.14 13:00;2;GDP (YoY)  (Q4)
2025.02.14 13:00;2;GDP (QoQ)  (Q4)
2025.02.14 16:30;3;Core Retail Sales (MoM)  (Jan)
2025.02.14 16:30;2;Export Price Index (MoM)  (Jan)
2025.02.14 16:30;2;Import Price Index (MoM)  (Jan)
2025.02.14 16:30;2;Retail Control (MoM)  (Jan)
2025.02.14 16:30;3;Retail Sales (MoM)  (Jan)
2025.02.14 17:15;2;Industrial Production (MoM)  (Jan)
2025.02.14 17:15;2;Industrial Production (YoY)  (Jan)
2025.02.14 18:00;2;Business Inventories (MoM)  (Dec)
2025.02.14 18:00;2;Retail Inventories Ex Auto  (Dec)
2025.02.14 21:00;2;Atlanta Fed GDPNow  (Q1)
2025.02.14 21:00;2;U.S. Baker Hughes Oil Rig Count
2025.02.14 21:00;2;U.S. Baker Hughes Total Rig Count
2025.02.14 23:30;2;CFTC GBP speculative net positions
2025.02.14 23:30;2;CFTC Crude Oil speculative net positions
2025.02.14 23:30;2;CFTC Gold speculative net positions
2025.02.14 23:30;2;CFTC Nasdaq 100 speculative net positions
2025.02.14 23:30;2;CFTC S&P 500 speculative net positions
2025.02.14 23:30;2;CFTC JPY speculative net positions
2025.02.14 23:30;2;CFTC EUR speculative net positions
2025.02.17 02:50;2;GDP (YoY)  (Q4)
2025.02.17 02:50;3;GDP (QoQ)  (Q4)
2025.02.17 02:50;2;GDP Price Index (YoY)  (Q4)
2025.02.17 07:30;2;Industrial Production (MoM)  (Dec)
2025.02.17 13:00;2;Eurogroup Meetings
2025.02.17 13:00;2;Trade Balance  (Dec)
2025.02.17 17:30;2;FOMC Member Harker Speaks
2025.02.17 18:20;2;FOMC Member Bowman Speaks
2025.02.18 02:00;2;Fed Waller Speaks
2025.02.18 10:00;2;Average Earnings Index +Bonus  (Dec)
2025.02.18 10:00;2;Claimant Count Change  (Jan)
2025.02.18 10:00;2;Employment Change 3M/3M (MoM)  (Dec)
2025.02.18 10:00;2;Unemployment Rate  (Dec)
2025.02.18 12:30;2;BoE Gov Bailey Speaks
2025.02.18 12:30;2;Labour Productivity  (Q4)
2025.02.18 12:30;2;Labour Productivity  (Q3)
2025.02.18 13:00;2;Eurogroup Meetings
2025.02.18 13:00;2;ZEW Economic Sentiment  (Feb)
2025.02.18 16:30;2;NY Empire State Manufacturing Index  (Feb)
2025.02.18 18:20;2;FOMC Member Daly Speaks
2025.02.18 21:00;2;Fed Vice Chair for Supervision Barr Speaks
2025.02.19 00:00;2;TIC Net Long-Term Transactions  (Dec)
2025.02.19 02:50;2;Adjusted Trade Balance
2025.02.19 02:50;2;Exports (YoY)  (Jan)
2025.02.19 02:50;2;Trade Balance  (Jan)
2025.02.19 05:00;3;U.S. President Trump Speaks
2025.02.19 10:00;2;CPI (MoM)  (Jan)
2025.02.19 10:00;3;CPI (YoY)  (Jan)
2025.02.19 10:00;2;PPI Input (MoM)  (Jan)
2025.02.19 11:00;2;European Central Bank Non-monetary Policy Meeting
2025.02.19 16:30;2;Building Permits  (Jan)
2025.02.19 16:30;2;Housing Starts (MoM)  (Jan)
2025.02.19 16:30;2;Housing Starts  (Jan)
2025.02.19 18:30;2;Atlanta Fed GDPNow  (Q1)
2025.02.19 21:00;2;20-Year Bond Auction
2025.02.19 22:00;3;FOMC Meeting Minutes
2025.02.20 00:30;2;API Weekly Crude Oil Stock
2025.02.20 04:00;2;China Loan Prime Rate 5Y  (Feb)
2025.02.20 04:00;2;PBoC Loan Prime Rate
2025.02.20 16:30;2;Continuing Jobless Claims
2025.02.20 16:30;3;Initial Jobless Claims
2025.02.20 16:30;3;Philadelphia Fed Manufacturing Index  (Feb)
2025.02.20 16:30;2;Philly Fed Employment  (Feb)
2025.02.20 18:00;2;US Leading Index (MoM)  (Jan)
2025.02.20 20:00;3;Crude Oil Inventories
2025.02.20 20:00;2;Cushing Crude Oil Inventories
2025.02.20 21:00;2;30-Year TIPS Auction
2025.02.20 22:30;2;Fed Vice Chair for Supervision Barr Speaks
2025.02.21 00:30;2;Fed's Balance Sheet
2025.02.21 02:30;2;National Core CPI (YoY)  (Jan)
2025.02.21 02:30;2;National CPI (MoM)  (Jan)
2025.02.21 10:00;2;Core Retail Sales (YoY)  (Jan)
2025.02.21 10:00;2;Core Retail Sales (MoM)  (Jan)
2025.02.21 10:00;2;Retail Sales (MoM)  (Jan)
2025.02.21 10:00;2;Retail Sales (YoY)  (Jan)
2025.02.21 14:30;2;RBI MPC Meeting Minutes
2025.02.21 17:30;2;ECB's Lane Speaks
2025.02.21 18:00;2;Existing Home Sales (MoM)  (Jan)
2025.02.21 18:00;3;Existing Home Sales  (Jan)
2025.02.21 18:00;2;Michigan 1-Year Inflation Expectations  (Feb)
2025.02.21 18:00;2;Michigan 5-Year Inflation Expectations  (Feb)
2025.02.21 18:00;2;Michigan Consumer Expectations  (Feb)
2025.02.21 18:00;2;Michigan Consumer Sentiment  (Feb)
2025.02.21 21:00;2;U.S. Baker Hughes Oil Rig Count
2025.02.21 21:00;2;U.S. Baker Hughes Total Rig Count
2025.02.21 23:30;2;CFTC GBP speculative net positions
2025.02.21 23:30;2;CFTC Crude Oil speculative net positions
2025.02.21 23:30;2;CFTC Gold speculative net positions
2025.02.21 23:30;2;CFTC Nasdaq 100 speculative net positions
2025.02.21 23:30;2;CFTC S&P 500 speculative net positions
2025.02.21 23:30;2;CFTC JPY speculative net positions
2025.02.21 23:30;2;CFTC EUR speculative net positions
2025.02.24 13:00;2;Core CPI (YoY)  (Jan)
2025.02.24 13:00;3;CPI (YoY)  (Jan)
2025.02.24 13:00;2;CPI (MoM)  (Jan)
2025.02.24 16:15;2;MPC Member Ramsden Speaks
2025.02.24 21:00;2;2-Year Note Auction
2025.02.25 16:00;2;ECB's Schnabel Speaks
2025.02.25 17:00;2;BoE MPC Member Pill Speaks
2025.02.25 17:00;2;S&P/CS HPI Composite - 20 n.s.a. (MoM)  (Dec)
2025.02.25 17:00;2;S&P/CS HPI Composite - 20 n.s.a. (YoY)  (Dec)
2025.02.25 18:00;3;CB Consumer Confidence  (Feb)
2025.02.25 19:45;2;Fed Vice Chair for Supervision Barr Speaks
2025.02.25 21:00;2;5-Year Note Auction
2025.02.26 00:30;2;API Weekly Crude Oil Stock
2025.02.26 08:00;2;BoJ Core CPI (YoY)
2025.02.26 16:00;2;Building Permits  (Jan)
2025.02.26 18:00;3;Crude Oil Inventories
2025.02.26 18:00;2;Cushing Crude Oil Inventories
2025.02.26 18:00;2;New Home Sales (MoM)  (Jan)
2025.02.26 18:00;3;New Home Sales  (Jan)
2025.02.26 20:00;2;FOMC Member Bostic Speaks
2025.02.26 21:00;2;7-Year Note Auction
2025.02.27 15:30;2;ECB Publishes Account of Monetary Policy Meeting
2025.02.27 16:30;2;Continuing Jobless Claims
2025.02.27 16:30;2;Core Durable Goods Orders (MoM)  (Jan)
2025.02.27 16:30;2;Core PCE Prices  (Q4)
2025.02.27 16:30;3;Durable Goods Orders (MoM)  (Jan)
2025.02.27 16:30;3;GDP (QoQ)  (Q4)
2025.02.27 16:30;2;GDP Price Index (QoQ)  (Q4)
2025.02.27 16:30;3;Initial Jobless Claims
