2025-08-01 04:45;2;Caixin Manufacturing PMI (MoM)  (Jul)
2025-08-01 09:00;2;Nationwide HPI (YoY)  (Jul)
2025-08-01 09:00;2;Nationwide HPI (MoM)  (Jul)
2025-08-01 11:00;2;HCOB Eurozone Manufacturing PMI  (Jul)
2025-08-01 11:30;2;S&P Global Manufacturing PMI  (Jul)
2025-08-01 12:00;2;Core CPI (YoY)  (Jul)
2025-08-01 12:00;2;CPI (MoM)  (Jul)
2025-08-01 12:00;3;CPI (YoY)  (Jul)
2025-08-01 15:30;2;Average Hourly Earnings (YoY) (YoY)  (Jul)
2025-08-01 15:30;3;Average Hourly Earnings (MoM)  (Jul)
2025-08-01 15:30;3;Nonfarm Payrolls  (Jul)
2025-08-01 15:30;2;Participation Rate  (Jul)
2025-08-01 15:30;2;Private Nonfarm Payrolls  (Jul)
2025-08-01 15:30;2;U6 Unemployment Rate  (Jul)
2025-08-01 15:30;3;Unemployment Rate  (Jul)
2025-08-01 16:45;3;S&P Global Manufacturing PMI  (Jul)
2025-08-01 17:00;2;Construction Spending (MoM)  (Jun)
2025-08-01 17:00;2;ISM Manufacturing Employment  (Jul)
2025-08-01 17:00;3;ISM Manufacturing PMI  (Jul)
2025-08-01 17:00;3;ISM Manufacturing Prices  (Jul)
2025-08-01 17:00;2;Michigan 1-Year Inflation Expectations  (Jul)
2025-08-01 17:00;2;Michigan 5-Year Inflation Expectations  (Jul)
2025-08-01 17:00;2;Michigan Consumer Expectations  (Jul)
2025-08-01 17:00;2;Michigan Consumer Sentiment  (Jul)
2025-08-01 18:55;2;Atlanta Fed GDPNow  (Q3)
2025-08-01 20:00;2;U.S. Baker Hughes Oil Rig Count
2025-08-01 20:00;2;U.S. Baker Hughes Total Rig Count
2025-08-01 22:10;2;FOMC Member Daly Speaks
2025-08-01 22:30;2;CFTC GBP speculative net positions
2025-08-01 22:30;2;CFTC Crude Oil speculative net positions
2025-08-01 22:30;2;CFTC Gold speculative net positions
2025-08-01 22:30;2;CFTC Nasdaq 100 speculative net positions
2025-08-01 22:30;2;CFTC S&P 500 speculative net positions
2025-08-01 22:30;2;CFTC JPY speculative net positions
2025-08-01 22:30;2;CFTC EUR speculative net positions
2025-08-04 17:00;2;Factory Orders (MoM)  (Jun)
2025-08-05 02:50;2;Monetary Policy Meeting Minutes
2025-08-05 03:30;2;au Jibun Bank Services PMI  (Jul)
2025-08-05 04:45;2;Caixin Services PMI  (Jul)
2025-08-05 06:35;2;10-Year JGB Auction
2025-08-05 11:00;2;HCOB Eurozone Composite PMI  (Jul)
2025-08-05 11:00;2;HCOB Eurozone Services PMI  (Jul)
2025-08-05 11:30;2;S&P Global Composite PMI  (Jul)
2025-08-05 11:30;2;S&P Global Services PMI  (Jul)
2025-08-05 15:30;2;Exports  (Jun)
2025-08-05 15:30;2;Imports  (Jun)
2025-08-05 15:30;2;Trade Balance  (Jun)
2025-08-05 16:45;2;S&P Global Composite PMI  (Jul)
2025-08-05 16:45;3;S&P Global Services PMI  (Jul)
2025-08-05 17:00;2;ISM Non-Manufacturing Employment  (Jul)
2025-08-05 17:00;3;ISM Non-Manufacturing PMI  (Jul)
2025-08-05 17:00;3;ISM Non-Manufacturing Prices  (Jul)
2025-08-05 20:00;2;3-Year Note Auction
2025-08-05 20:00;2;Atlanta Fed GDPNow  (Q3)
2025-08-05 23:30;2;API Weekly Crude Oil Stock
2025-08-06 07:30;2;Interest Rate Decision
2025-08-06 11:30;2;S&P Global Construction PMI  (Jul)
2025-08-06 17:30;3;Crude Oil Inventories
2025-08-06 17:30;2;Cushing Crude Oil Inventories
2025-08-06 19:45;2;FOMC Member Daly Speaks
2025-08-06 20:00;3;10-Year Note Auction
2025-08-07 06:00;2;Imports (YoY)  (Jul)
2025-08-07 06:00;2;Trade Balance (USD)  (Jul)
2025-08-07 06:00;2;Exports (YoY)  (Jul)
2025-08-07 09:00;2;Halifax House Price Index (YoY)  (Jul)
2025-08-07 09:00;2;Halifax House Price Index (MoM)  (Jul)
2025-08-07 11:00;2;ECB Economic Bulletin
2025-08-07 12:00;2;Mortgage Rate (GBP)  (Jul)
2025-08-07 14:00;2;BoE MPC vote cut  (Aug)
2025-08-07 14:00;2;BoE MPC vote hike  (Aug)
2025-08-07 14:00;2;BoE MPC vote unchanged  (Aug)
2025-08-07 14:00;3;BoE Interest Rate Decision  (Aug)
2025-08-07 14:00;2;BoE MPC Meeting Minutes
2025-08-07 14:30;2;BOE Inflation Letter
2025-08-07 15:30;2;Continuing Jobless Claims
2025-08-07 15:30;3;Initial Jobless Claims
2025-08-07 15:30;2;Nonfarm Productivity (QoQ)  (Q2)
2025-08-07 15:30;2;Unit Labor Costs (QoQ)  (Q2)
2025-08-07 16:15;2;BoE Gov Bailey Speaks
2025-08-07 17:00;2;FOMC Member Bostic Speaks
2025-08-07 18:00;2;NY Fed 1-Year Consumer Inflation Expectations  (Jul)
2025-08-07 20:00;3;30-Year Bond Auction
2025-08-07 20:00;2;Atlanta Fed GDPNow  (Q3)
2025-08-07 22:00;2;Consumer Credit  (Jun)
2025-08-07 23:30;2;Fed's Balance Sheet
2025-08-08 02:30;2;Household Spending (YoY)  (Jun)
2025-08-08 02:30;2;Household Spending (MoM)  (Jun)
2025-08-08 02:50;2;Adjusted Current Account  (Jun)
2025-08-08 02:50;2;Adjusted Current Account
2025-08-08 02:50;2;Current Account n.s.a.  (Jun)
2025-08-08 14:15;2;BoE MPC Member Pill Speaks
2025-08-08 20:00;2;U.S. Baker Hughes Oil Rig Count
2025-08-08 20:00;2;U.S. Baker Hughes Total Rig Count
2025-08-08 22:30;2;CFTC GBP speculative net positions
2025-08-08 22:30;2;CFTC Crude Oil speculative net positions
2025-08-08 22:30;2;CFTC Gold speculative net positions
2025-08-08 22:30;2;CFTC Nasdaq 100 speculative net positions
2025-08-08 22:30;2;CFTC S&P 500 speculative net positions
2025-08-08 22:30;2;CFTC JPY speculative net positions
2025-08-08 22:30;2;CFTC EUR speculative net positions
2025-08-09 04:30;2;CPI (MoM)  (Jul)
2025-08-09 04:30;2;CPI (YoY)  (Jul)
2025-08-09 04:30;2;PPI (YoY)  (Jul)
2025-08-09 19:15;2;FOMC Member Bowman Speaks
2025-08-12 02:01;2;BRC Retail Sales Monitor (YoY)  (Jul)
2025-08-12 09:00;2;Average Earnings Index +Bonus  (Jun)
2025-08-12 09:00;2;Claimant Count Change  (Jul)
2025-08-12 09:00;2;Employment Change 3M/3M (MoM)  (Jun)
2025-08-12 09:00;2;Unemployment Rate  (Jun)
2025-08-12 12:00;2;ZEW Economic Sentiment  (Aug)
2025-08-12 13:30;2;CPI (YoY)  (Jul)
2025-08-12 14:00;2;OPEC Monthly Report
2025-08-12 15:30;3;Core CPI (MoM)  (Jul)
2025-08-12 15:30;2;Core CPI (YoY)  (Jul)
2025-08-12 15:30;3;CPI (YoY)  (Jul)
2025-08-12 15:30;3;CPI (MoM)  (Jul)
2025-08-12 21:00;2;Federal Budget Balance  (Jul)
2025-08-14 02:01;2;RICS House Price Balance  (Jul)
2025-08-14 09:00;2;Business Investment (QoQ)  (Q2)
2025-08-14 09:00;3;GDP (YoY)  (Q2)
2025-08-14 09:00;3;GDP (MoM)  (Jun)
2025-08-14 09:00;3;GDP (QoQ)  (Q2)
2025-08-14 09:00;2;Industrial Production (MoM)  (Jun)
2025-08-14 09:00;2;Manufacturing Production (MoM)  (Jun)
2025-08-14 09:00;2;Monthly GDP 3M/3M Change  (Jun)
2025-08-14 09:00;2;Trade Balance  (Jun)
2025-08-14 09:00;2;Trade Balance Non-EU  (Jun)
2025-08-14 09:30;2;WPI Inflation (YoY)  (Jul)
2025-08-14 11:30;2;Labour Productivity  (Q1)
2025-08-14 12:00;2;GDP (YoY)  (Q2)
2025-08-14 12:00;2;GDP (QoQ)  (Q2)
2025-08-14 12:00;2;Industrial Production (MoM)  (Jun)
2025-08-14 15:30;2;Core PPI (MoM)  (Jul)
2025-08-14 15:30;3;PPI (MoM)  (Jul)
2025-08-15 02:50;3;GDP (QoQ)  (Q2)
2025-08-15 02:50;2;GDP (YoY)  (Q2)
2025-08-15 02:50;2;GDP Price Index (YoY)  (Q2)
2025-08-15 05:00;2;Fixed Asset Investment (YoY)  (Jul)
2025-08-15 05:00;2;Industrial Production (YoY)  (Jul)
2025-08-15 05:00;2;Chinese Industrial Production YTD  (YoY)  (Jul)
2025-08-15 05:00;2;Chinese Unemployment Rate  (Jul)
2025-08-15 07:30;2;Industrial Production (MoM)  (Jun)
2025-08-15 15:30;3;Core Retail Sales (MoM)  (Jul)
2025-08-15 15:30;2;Export Price Index (MoM)  (Jul)
2025-08-15 15:30;2;Import Price Index (MoM)  (Jul)
2025-08-15 15:30;2;NY Empire State Manufacturing Index  (Aug)
2025-08-15 15:30;2;Retail Control (MoM)  (Jul)
2025-08-15 15:30;3;Retail Sales (MoM)  (Jul)
2025-08-15 16:15;2;Industrial Production (MoM)  (Jul)
2025-08-15 16:15;2;Industrial Production (YoY)  (Jul)
2025-08-15 17:00;2;Business Inventories (MoM)  (Jun)
2025-08-15 17:00;2;Michigan 1-Year Inflation Expectations  (Aug)
2025-08-15 17:00;2;Michigan 5-Year Inflation Expectations  (Aug)
2025-08-15 17:00;2;Michigan Consumer Expectations  (Aug)
2025-08-15 17:00;2;Michigan Consumer Sentiment  (Aug)
2025-08-15 17:00;2;Retail Inventories Ex Auto  (Jun)
2025-08-15 20:00;2;Atlanta Fed GDPNow  (Q3)
2025-08-15 23:00;2;TIC Net Long-Term Transactions  (Jun)
2025-08-18 12:00;2;Trade Balance  (Jun)
2025-08-19 15:30;2;Building Permits  (Jul)
2025-08-19 15:30;2;Housing Starts  (Jul)
2025-08-19 15:30;2;Housing Starts (MoM)  (Jul)
2025-08-19 18:30;2;Atlanta Fed GDPNow  (Q3)
2025-08-20 02:50;2;Exports (YoY)  (Jul)
2025-08-20 02:50;2;Trade Balance  (Jul)
2025-08-20 04:00;2;China Loan Prime Rate 5Y  (Aug)
2025-08-20 09:00;3;CPI (YoY)  (Jul)
2025-08-20 09:00;2;CPI (MoM)  (Jul)
2025-08-20 12:00;2;Core CPI (YoY)  (Jul)
2025-08-20 12:00;2;CPI (MoM)  (Jul)
2025-08-20 12:00;3;CPI (YoY)  (Jul)
2025-08-21 03:30;2;au Jibun Bank Services PMI  (Aug)
2025-08-21 11:00;2;HCOB Eurozone Manufacturing PMI  (Aug)
2025-08-21 11:00;2;HCOB Eurozone Composite PMI  (Aug)
2025-08-21 11:00;2;HCOB Eurozone Services PMI  (Aug)
2025-08-21 11:30;2;S&P Global Composite PMI  (Aug)
2025-08-21 11:30;2;S&P Global Manufacturing PMI  (Aug)
2025-08-21 11:30;2;S&P Global Services PMI  (Aug)
2025-08-21 15:30;3;Philadelphia Fed Manufacturing Index  (Aug)
2025-08-21 15:30;2;Philly Fed Employment  (Aug)
2025-08-21 16:45;3;S&P Global Manufacturing PMI  (Aug)
2025-08-21 16:45;2;S&P Global Composite PMI  (Aug)
2025-08-21 16:45;3;S&P Global Services PMI  (Aug)
2025-08-21 17:00;3;Existing Home Sales  (Jul)
2025-08-21 17:00;2;Existing Home Sales (MoM)  (Jul)
2025-08-21 17:00;2;US Leading Index (MoM)  (Jul)
2025-08-22 02:30;2;National Core CPI (YoY)  (Jul)
2025-08-22 09:00;2;Core Retail Sales (YoY)  (Jul)
2025-08-22 09:00;2;Core Retail Sales (MoM)  (Jul)
2025-08-22 09:00;2;Retail Sales (YoY)  (Jul)
2025-08-22 09:00;2;Retail Sales (MoM)  (Jul)
2025-08-26 18:30;2;Atlanta Fed GDPNow  (Q3)
2025-08-29 17:00;2;Michigan 1-Year Inflation Expectations  (Aug)
2025-08-29 17:00;2;Michigan 5-Year Inflation Expectations  (Aug)
2025-08-29 17:00;2;Michigan Consumer Expectations  (Aug)
2025-08-29 17:00;2;Michigan Consumer Sentiment  (Aug)
2025-08-29 18:30;2;Atlanta Fed GDPNow  (Q3)
2025-09-02 20:00;2;Atlanta Fed GDPNow  (Q3)
2025-09-04 20:00;2;Atlanta Fed GDPNow  (Q3)
2025-09-10 20:00;2;Atlanta Fed GDPNow  (Q3)
2025-09-11 14:00;2;OPEC Monthly Report
2025-09-16 20:00;2;Atlanta Fed GDPNow  (Q3)
2025-09-17 18:30;2;Atlanta Fed GDPNow  (Q3)
2025-09-17 21:00;3;Fed Interest Rate Decision
2025-09-19 06:00;3;BoJ Interest Rate Decision
2025-09-26 18:30;2;Atlanta Fed GDPNow  (Q3)
2025-10-13 14:00;2;OPEC Monthly Report
2025-10-29 21:00;3;Fed Interest Rate Decision
2025-10-30 06:00;3;BoJ Interest Rate Decision
2025-11-12 15:00;2;OPEC Monthly Report
2025-12-10 22:00;3;Fed Interest Rate Decision
2025-12-11 15:00;2;OPEC Monthly Report
2025-12-19 06:00;3;BoJ Interest Rate Decision
